,Author,Title,Poem,Form
58,Dante Gabriel Rossetti,The Ballad Of Dead Ladies,"Tell me now in what hidden way is 
Lady Flora the lovely Roman? 
Where's Hipparchia, and where is Thais, 
Neither of them the fairer woman? 
Where is Echo, beheld of no man, 
Only heard on river and mere-- 
She whose beauty was more than human?-- 
But where are the snows of yester-year? 

Where's Heloise, the learned nun, 
For whose sake Abeillard, I ween, 
Lost manhood and put priesthood on? 
(From Love he won such dule and teen!) 
And where, I pray you, is the Queen 
Who willed that Buridan should steer 
Sewed in a sack's mouth down the Seine?-- 
But where are the snows of yester-year? 

White Queen Blanche, like a queen of lilies, 
With a voice like any mermaiden-- 
Bertha Broadfoot, Beatrice, Alice, 
And Ermengarde the lady of Maine-- 
And that good Joan whom Englishmen 
At Rouen doomed and burned her there-- 
Mother of God, where are they then?-- 
But where are the snows of yester-year? 

Nay, never ask this week, fair lord, 
Where they are gone, nor yet this year, 
Except with this for an overword-- 
But where are the snows of yester-year?",Ballad
59,Eugene Field,Ballad Of Women I Love,"Prudence Mears hath an old blue plate
 Hid away in an oaken chest,
And a Franklin platter of ancient date
 Beareth Amandy Baker's crest;
What times soever I've been their guest,
 Says I to myself in an undertone:
""Of womenfolk, it must be confessed,
 These do I love, and these alone.""

Well, again, in the Nutmeg State,
 Dorothy Pratt is richly blest
With a relic of art and a land effete--
 A pitcher of glass that's cut, not pressed.
And a Washington teapot is possessed
 Down in Pelham by Marthy Stone--
Think ye now that I say in jest
 ""These do I love, and these alone?""

Were Hepsy Higgins inclined to mate,
 Or Dorcas Eastman prone to invest
In Cupid's bonds, they could find their fate
 In the bootless bard of Crockery Quest.
For they've heaps of trumpery--so have the rest
 Of those spinsters whose ware I'd like to own;
You can see why I say with such certain zest,
 ""These do I love, and these alone.""",Ballad
60,Michael Drayton,Ode To The Cambro-Britons And Their Harp..,"Fair stood the wind for France,
   When we our sails advance;
   Nor now to prove our chance
       Longer will tarry;
   But putting to the main,
   At Caux, the mouth of Seine,
   With all his martial train
       Landed King Harry.

   And taking many a fort,
  Furnish'd in warlike sort,
  Marcheth towards Agincourt
      In happy hour;
  Skirmishing day by day
  With those that stopp'd his way,
  Where the French gen'ral lay
      With all his power.

  Which, in his height of pride,
  King Henry to deride,
  His ransom to provide
      To the King sending;
  Which he neglects the while,
  As from a nation vile
  Yet with an angry smile
      Their fall portending.

  And turning to his men
  Quoth our brave Henry then:
  ""Though they to one be ten
      Be not amazed.
  Yet have we well begun:
  Battles so bravely won
  Have ever to the sun
      By Fame been raised!

  ""And for myself,"" quoth he,
  ""This my full rest shall be:
  England ne'er mourn for me,
      Nor more esteem me;
  Victor I will remain,
  Or on this earth lie slain;
  Never shall she sustain
      Loss to redeem me!

  ""Poitiers and Cressy tell
  When most their pride did swell
  Under our swords they fell;
      No less our skill is
  Than when our grandsire great,
  Claiming the regal seat,
  By many a warlike feat
      Lopp'd the French lilies.""

  The Duke of York so dread
  The eager vaward led;
  With the main Henry sped
      Amongst his henchmen:
  Excester had the rear,
  A braver man not there
  O Lord, how hot they were
      On the false Frenchmen!

  They now to fight are gone;
  Armour on armour shone;
  Drum now to drum did groan:
       To hear, was wonder;
  That, with cries they make,
  The very earth did shake;
  Trumpet to trumpet spake,
      Thunder to thunder.

  Well it thine age became,
  O noble Erpingham,
  Which didst the signal aim
      To our hid forces;
  When, from a meadow by,
  Like a storm suddenly,
  The English archery
      Stuck the French horses

  With Spanish yew so strong,
  Arrows a cloth-yard long,
  That like to serpents stung,
      Piercing the weather.
  None from his fellow starts,
  But playing manly parts,
  And like true English hearts
      Stuck close together.

  When down their bows they threw,
  And forth their bilboes drew,
  And on the French they flew,
      Not one was tardy;
  Arms were from shoulders sent,
  Scalps to the teeth were rent,
  Down the French peasants went:
      Our men were hardy.

  This while our noble King,
  His broad sword brandishing,
  Down the French host did ding,
      As to o'erwhelm it.
  And many a deep wound lent,
  His arms with blood besprent,
  And many a cruel dent
      Bruised his helmet.

  Gloster, that duke so good,
  Next of the royal blood,
  For famous England stood
    With his brave brother.
 Clarence, in steel so bright,
 Though but a maiden knight,
 Yet in that furious fight
    Scarce such another!

 Warwick in blood did wade,
 Oxford the foe invade,
 And cruel slaughter made,
    Still as they ran up.
 Suffolk his axe did ply;
 Beaumont and Willoughby
 Bare them right doughtily;
    Ferrers and Fanhope.

 Upon Saint Crispin's Day
 Fought was this noble fray,
 Which fame did not delay
    To England to carry.
 O when shall English men
 With such acts fill a pen,
 Or England breed again
    Such a King Harry?",Ballad
61,Algernon Charles Swinburne,"A Ballad Of François Villon, Prince Of A..","Bird of the bitter bright grey golden morn 
Scarce risen upon the dusk of dolorous years, 
First of us all and sweetest singer born 
Whose far shrill note the world of new men hears 
Cleave the cold shuddering shade as twilight clears; 
When song new-born put off the old world's attire 
And felt its tune on her changed lips expire, 
Writ foremost on the roll of them that came 
Fresh girt for service of the latter lyre, 
Villon, our sad bad glad mad brother's name! 


Alas the joy, the sorrow, and the scorn, 
That clothed thy life with hopes and sins and fears, 
And gave thee stones for bread and tares for corn 
And plume-plucked gaol-birds for thy starveling peers 
Till death clipt close their flight with shameful shears; 
Till shifts came short and loves were hard to hire, 
When lilt of song nor twitch of twangling wire 
Could buy thee bread or kisses; when light fame 
Spurned like a ball and haled through brake and briar, 
Villon, our sad bad glad mad brother's name! 


Poor splendid wings so frayed and soiled and torn! 
Poor kind wild eyes so dashed with light quick tears! 
Poor perfect voice, most blithe when most forlorn, 
That rings athwart the sea whence no man steers 
Like joy-bells crossed with death-bells in our ears! 
What far delight has cooled the fierce desire 
That like some ravenous bird was strong to tire 
On that frail flesh and soul consumed with flame, 
But left more sweet than roses to respire, 
Villon, our sad bad glad mad brother's name? 


Prince of sweet songs made out of tears and fire, 
A harlot was thy nurse, a God thy sire; 
Shame soiled thy song, and song assoiled thy shame. 
But from thy feet now death has washed the mire, 
Love reads out first at head of all our quire, 
Villon, our sad bad glad mad brother's name.",Ballad
62,Banjo Paterson,The Ballad Of G. R. Dibbs,"This is the story of G.R.D., 
Who went on a mission across the sea 
To borrow some money for you and me. 

This G. R. Dibbs was a stalwart man 
Who was built on a most extensive plan, 
And a regular staunch Republican. 

But he fell in the hands of the Tory crew 
Who said, ""It's a shame that a man like you 
Should teach Australia this nasty view. 

""From her mother's side she should ne'er be gone, 
And she ought to be glad to be smiled upon, 
And proud to be known as our hanger-on."" 

And G. R. Dibbs, he went off his peg 
At the swells who came for his smiles to beg 
And the Prince of Wales -- who was pulling his leg 

And he told them all when the wine had flown, 
""The Australian has got no land of his own, 
His home is England, and there alone."" 

So he strutted along with the titled band 
And he sold the pride of his native land 
For a bow and a smile and a shake of the hand. 

And the Tory drummers they sit and call: 
""Send over your leaders great and small; 
For the price is low, and we'll buy them all 

""With a tinsel title, a tawdry star 
Of a lower grade than our titles are, 
And a puff at a prince's big cigar."" 

And the Tories laugh till they crack their ribs 
When they think how they purchased G. R. Dibbs.",Ballad
63,Banjo Paterson,The Ballad Of That P.N.,"The shades of night had fallen at last, 
When through the house a shadow passed, 
That once had been the Genial Dan, 
But now become a desperate man, 
At question time he waited near, 
And on the Premier's startled ear 
A voice fell like half a brick -- 
""Did ye, or did ye not, pay Crick 
Did ye?"" 
By land and sea the Premier sped, 
But found his foe where'er he fled, 
The sailors swore -- with whitened lip -- 
That Neptune swam behind the ship: 
When to the stern the Premier ran, 
Behold, 'twas no one else but Dan, 
And through the roaring of the gale 
That clarion voice took up the tale, 
""Ahot there! Answer, straight and slick! 
Did not the Ministry pay Crick 
Did they?"" 

In railway trains he sought retreat, 
But soon, from underneath the seat, 
With blazing eye and bristling beard, 
His ancient enemy appeared, 
And like a boiling torrent ran 
The accents of the angry Dan -- 
""Tell me, John See, and tell me quick 
Did not ye pay your shares to Crick 
Did ye?""",Ballad
64,Banjo Paterson,The Ballad Of The Carpet Bag,"Ho! Darkies, don't you hear dose voters cryin' 
Pack dat carpet bag! 
You must get to de Poll, you must get there flyin'; 
Pack dat carpet bag! 
You must travel by de road, you must travel by de train, 
And the things what you've done you will have to explain, 
And the things what you've promised, you must promise 'em again. 
Pack dat carpet bag! 
Hear dem voters callin! 
Pack de clean boiled rag. 
For there's grass in the west, and the rain am fallin'. 
Pack dat carpet bag! 

You must pack up a volume of Coghlan's Figures, 
Pack dat carpet bag! 
And a lot o' little jokes to amuse those niggers. 
Pack dat carpet bag! 
You must wheedle all de gals with a twinkle of your eye, 
You must bob down your head when de eggs begin to fly. 
Oh! those eggs what they're saving, and they'll throw 'em by and by. 
Pack dat carpet bag! 

Hear dem voters callin'! 
Pack de clean boiled rag. 
For there's grass in the west, and the rain am fallin'. 
Pack dat carpet bag! 

You must get upon a stump, you must practise speakin', 
Pack dat carpet bag! 
You must follow Georgie Reid or Alfred Deakin. 
Pack dat carpet bag! 
You must come to de scratch, or you're bound to fail, 
For it ain't any time to be sittin' on de rail, 
Or de votes that you'll get -- they won't keep you out o' jail. 
Pack dat carpet bag! 

Hear dem voters callin'! 
Pack de clean boiled rag. 
For there's grass in the west, and the rain am fallin'. 
Pack dat carpet bag! 

And supposin' that you're beat, and you feel like cryin', 
Pack dat carpet bag! 
You must hustle back to work -- just to keep from dyin'. 
Pack dat carpet bag! 
You must travel second-class when you travel by de train, 
For you haven't got a pass on de end of your chain, 
While the other fellow's packing for de great campaign. 
Pack dat carpet bag! 

Hear dem voters callin'! 
Pack de clean boiled rag. 
For there's grass in the west, and the rain am fallin'. 
Pack dat carpet bag!",Ballad
65,Ankoku Gekido,The Gothic Ballad,"I walk carelessly down the dark road
My heavy black boots constantly clicking
Clicking on the cold cement
My long black and velvet Trench coat 
Billowing in the slight breeze
My Chest slightly rising under my tight corset
My chains on my pants jingling together
As I walk down this Moon lit road
Staring up at the midnight moon
This is the ballad
The ballad of the lost
Of the silent warriors
Of the people you pass by and call freaks
Of the people
Who will save your soul
For our souls are pure
Our souls sing this ballad
The ballad of the night
The ballad of the pure hearts",Ballad
66,Paul Laurence Dunbar,A Border Ballad,"OH, I haven't got long to live, for we all
Die soon, e'en those who live longest;
And the poorest and weakest are taking their chance
Along with the richest and strongest.
So it's heigho for a glass and a song,
And a bright eye over the table,
And a dog for the hunt when the game is flush.
And the pick of a gentleman's stable.
There is Dimmock o' Dune, he was here yesternight,
But he's rotting to-day on Glen Arragh;
'Twas the hand o' MacPherson that gave him the blow,
And the vultures shall feast on his marrow.
But it's heigho for a brave old song
And a glass while we are able;
Here's a health to death and another cup
To the bright eye over the table.
I can show a broad back and a jolly deep chest,
But who argues now on appearance?
A blow or a thrust or a stumble at best
May send me to-day to my clearance.
Then it's heigho for the things I love,
My mother'll be soon wearing sable,
But give me my horse and my dog and my glass,
And a bright eye over the table.",Ballad
67,Banjo Paterson,The Ballad Of Cockatoo Dock,"Of all the docks upon the blue 
There was no dockyard, old or new, 
To touch the dock at Cockatoo. 

Of all the ministerial clan 
There was no nicer, worthier man 
Than Admiral O'Sullivan. 

Of course, we mean E. W. 
O'Sullivan, the hero who 
Controlled the dock at Cockatoo. 

To workmen he explained his views -- 
""You need not toil unless you choose, 
Your only work is drawing screws."" 

And sometimes to their great surprise 
When votes of censure filled the skies 
He used to give them all a rise. 

""What odds about a pound or two?"" 
Exclaimed the great E. W. 
O'Sullivan at Cockatoo. 

The dockyard superintendent, he 
Was not at all what he should be -- 
He sneered at all this sympathy. 

So when he gave a man the sack 
O'Sullivan got on his track 
And straightway went and fetched him back. 

And with a sympathetic tear 
He'd say, ""How dare you interfere, 
You most misguided engineer? 

""Your sordid manners please amend -- 
No man can possibly offend 
Who has a Member for a friend. 

""With euchre, or a friendly rub, 
And whisky, from the nearest 'pub', 
We'll make the dockyard like a club. 

""Heave ho, my hearties, play away, 
We'll do no weary work today. 
What odds -- the public has to pay! 

""And if the public should complain 
I'll go to Broken Hill by train 
To watch McCarthy making rain."" 

And there, with nothing else to do 
No doubt the great E. W. 
Will straightway raise McCarthy's screw.",Ballad
68,Alexander Pope,The Challenge: A Court Ballad,"I. 
To one fair lady out of Court,
And two fair ladies in,
Who think the Turk and Pope a sport,
And wit and love no sin!
Come, these soft lines, with nothing stiff in,
To Bellenden, Lepell, and Griffin.
With a fa, la, la.

II.

What passes in the dark third row,
And what behind the scene,
Couches and crippled chairs I know,
And garrets hung with green;
I know the swing of sinful hack,
Where many damsels cry alack.
With a fa, la, la.

III.
Then why to Courts should I repair,
Where's such ado with Townsend?
To hear each mortal stamp and swear,
And every speech with 'Zounds' end;
To hear them rail at honest Sunderland,
And rashly blame the realm of Blunderland.
With a fa, la, la.

IV. 
Alas! like Schutz I cannot pun,
Like Grafton court the Germans;
Tell Pickenbourg how slim she's grown,
Like Meadows run to sermons;
To court ambitious men may roam,
But I and Marlbro' stay at home.
With a fa, la, la.

V. 
In truth, by what I can discern,
Of courtiers, 'twixt you three,
Some wit you have, and more may learn
From Court, than Gay or Me:
Perhaps, in time, you'll leave high diet,
To sup with us on milk and quiet.
With a fa, la, la.

VI. 
At Leicester Fields, a house full nigh,
With door all painted green,
(A Milliner, I mean); 
There may you meet us three to three,
For Gay can well make two of Me.
With a fa, la, la. 

VII. 
But should you catch the prudish itch,
And each become a coward,
Bring sometimes with you lady Rich,
And sometimes mistress Howard;
For virgins, to keep chaste, must go
Abroad with such as are not so.
With a fa, la, la.

VIII.
And thus, fair maids, my ballad ends;
God send the king safe landing;
And make all honest ladies friends
To armies that are standing;
Preserve the limits of those nations,
And take off ladies' limitations.
With a fa, la, la.",Ballad
69,Banjo Paterson,The Ballad Of The Calliope,"By the far Samoan shore, 
Where the league-long rollers pour 
All the wash of the Pacific on the coral-guarded bay, 
Riding lightly at their ease, 
In the calm of tropic seas, 
The three great nations' warships at their anchors proudly lay. 
Riding lightly, head to wind, 
With the coral reefs behind, 
Three German and three Yankee ships were mirrored in the blue; 
And on one ship unfurled 
Was the flag that rules the world -- 
For on the old Calliope the flag of England flew. 

When the gentle off-shore breeze, 
That had scarcely stirred the trees, 
Dropped down to utter stillness, and the glass began to fall, 
Away across the main 
Lowered the coming hurricane, 
And far away to seaward hung the cloud-wrack like a pall. 

If the word had passed around, 
""Let us move to safer ground; 
Let us steam away to seaward"" -- then his tale were not to tell! 
But each Captain seemed to say 
""If the others stay, I stay!"" 
And they lingered at their moorings till the shades of evening fell. 

Then the cloud-wrack neared them fast, 
And there came a sudden blast, 
And the hurricane came leaping down a thousand miles of main! 
Like a lion on its prey, 
Leapt the storm fiend on the bay, 
And the vessels shook and shivered as their cables felt the strain. 

As the surging seas came by, 
That were running mountains high, 
The vessels started dragging, drifting slowly to the lee; 
And the darkness of the night 
Hid the coral reefs from sight, 
And the Captains dared not risk the chance to grope their way to sea. 

In the dark they dared not shift! 
They were forced to wait and drift; 
All hands stood by uncertain would the anchors hold or no. 
But the men on deck could see, 
If a chance for them might be, 
There was little chance of safety for the men who were below. 

Through that long, long night of dread, 
While the storm raged overhead, 
They were waiting by their engines, with the furnace fires aroar; 
So they waited, staunch and true, 
Though they knew, and well they knew, 
They must drown like rats imprisoned if the vessel touched the shore. 

When the grey dawn broke at last, 
And the long, long night was past, 
While the hurricane redoubled, lest its prey should steal away, 
On the rocks, all smashed and strown, 
Were the German vessels thrown, 
While the Yankees, swamped and helpless, drifted shorewards down the bay. 

Then at last spoke Captain Kane, 
""All our anchors are in vain, 
And the Germans and the Yankees they have drifted to the lee! 
Cut the cables at the bow! 
We must trust the engines now! 
Give her steam, and let her have it, lads! we'll fight her out to sea!"" 

And the answer came with cheers 
From the stalwart engineers, 
From the grim and grimy firemen at the furnaces below; 
And above the sullen roar 
Of the breakers on the shore 
Came the throbbing of the engines as they laboured to and fro. 

If the strain should find a flaw, 
Should a bolt or rivet draw, 
Then -- God help them! for the vessel were a plaything in the tide! 
With a face of honest cheer 
Quoth an English engineer, 
""I will answer for the engiines that were built on old Thames-side! 

""For the stays and stanchions taut, 
For the rivets truly wrought, 
For the valves that fit their faces as a glove should fit the hand. 
Give her every ounce of power; 
If we make a knot an hour 
Then it's way enough to steer her, and we'll drive her from the land."" 

Life a foam-flake tossed and thrown, 
She could barely hold her own, 
While the other ships all helplessly were drifting to the lee. 
Through the smother and the rout 
The Calliope steamed out -- 
And they cheered her from the Trenton that was foundering in the sea. 

Ay! drifting shoreward there, 
All helpless as they were, 
Their vessel hurled upon the reefs as weed ashore is hurled, 
Without a thought of fear 
The Yankees raised a cheer -- 
A cheer that English-speaking folk should echo round the world.",Ballad
