,Author,Title,Poem
0,Ted Kooser,A Birthday Poem,"Just past dawn, the sun stands
with its heavy red head
in a black stanchion of trees,
waiting for someone to come
with his bucket
for the foamy white light,
and then a long day in the pasture.
I too spend my days grazing,
feasting on every green moment
till darkness calls,
and with the others
I walk away into the night,
swinging the little tin bell
of my name."
1,Edgar Allan Poe,A Dream Within A Dream,"Take this kiss upon the brow!
And, in parting from you now,
Thus much let me avow--
You are not wrong, who deem
That my days have been a dream;
Yet if hope has flown away
In a night, or in a day,
In a vision, or in none,
Is it therefore the less gone?
All that we see or seem
Is but a dream within a dream.
I stand amid the roar
Of a surf-tormented shore,
And I hold within my hand
Grains of the golden sand--
How few! yet how they creep
Through my fingers to the deep,
While I weep--while I weep!
O God! can I not grasp
Them with a tighter clasp?
O God! can I not save
One from the pitiless wave?
Is all that we see or seem
But a dream within a dream?"
2,Ezra Pound,A Girl,"The tree has entered my hands,
The sap has ascended my arms,
The tree has grown in my breast-
Downward,
The branches grow out of me, like arms. 
Tree you are,
Moss you are,
You are violets with wind above them.
A child - so high - you are,
And all this is folly to the world."
3,William Butler Yeats,A Poet To His Beloved,"I BRING you with reverent hands
The books of my numberless dreams,
White woman that passion has worn
As the tide wears the dove-grey sands,
And with heart more old than the horn
That is brimmed from the pale fire of time:
White woman with numberless dreams,
I bring you my passionate rhyme."
4,William Blake,A Poison Tree,"I was angry with my friend;
I told my wrath, my wrath did end.
I was angry with my foe:
I told it not, my wrath did grow.
And I waterd it in fears,
Night & morning with my tears:
And I sunned it with smiles,
And with soft deceitful wiles.
And it grew both day and night,
Till it bore an apple bright.
And my foe beheld it shine,
And he knew that it was mine.
And into my garden stole.
When the night had veiled the pole;
In the morning glad I see,
My foe outstretchd beneath the tree."
5,E. E. Cummings,A pretty a day,"A pretty a day
(and every fades)
is here and away
(but born are maids
to flower an hour
in all,all)
o yes to flower
until so blithe
a doer a wooer
some limber and lithe
some very fine mower
a tall;tall
some jerry so very
(and nellie and fan)
some handsomest harry
(and sally and nan
they tremble and cower
so pale:pale)
for betty was born
to never say nay
but lucy could learn
and lily could pray
and fewer were shyer
than doll. doll"
6,Ogden Nash,A Word to Husbands,"To keep your marriage brimming
With love in the loving cup,
Whenever you’re wrong, admit it;
Whenever you’re right, shut up."
7,William Shakespeare,All the World's a Stage,"All the world's a stage,
And all the men and women merely players;
They have their exits and their entrances,
And one man in his time plays many parts,
His acts being seven ages. At first, the infant,
Mewling and puking in the nurse's arms.
Then the whining schoolboy, with his satchel
And shining morning face, creeping like snail
Unwillingly to school. And then the lover,
Sighing like furnace, with a woeful ballad
Made to his mistress' eyebrow. Then a soldier,
Full of strange oaths and bearded like the pard,
Jealous in honor, sudden and quick in quarrel,
Seeking the bubble reputation
Even in the cannon's mouth. And then the justice,
In fair round belly with good capon lined,
With eyes severe and beard of formal cut,
Full of wise saws and modern instances;
And so he plays his part. The sixth age shifts
Into the lean and slippered pantaloon,
With spectacles on nose and pouch on side;
His youthful hose, well saved, a world too wide
For his shrunk shank, and his big manly voice,
Turning again toward childish treble, pipes
And whistles in his sound. Last scene of all,
That ends this strange eventful history,
Is second childishness and mere oblivion,
Sans teeth, sans eyes, sans taste, sans everything."
8,Allen Ginsberg,America,"America I've given you all and now I'm nothing.
America two dollars and twentyseven cents January
17, 1956.
I can't stand my own mind.
America when will we end the human war?
Go fuck yourself with your atom bomb.
I don't feel good don't bother me.
I won't write my poem till I'm in my right mind.
America when will you be angelic?
When will you take off your clothes?
When will you look at yourself through the grave?
When will you be worthy of your million Trotskyites?
America why are your libraries full of tears?
America when will you send your eggs to India?
I'm sick of your insane demands.
When can I go into the supermarket and buy what I
need with my good looks?
America after all it is you and I who are perfect not
the next world.
Your machinery is too much for me.
You made me want to be a saint.
There must be some other way to settle this argument.
Burroughs is in Tangiers I don't think he'll come back
it's sinister.
Are you being sinister or is this some form of practical
joke?
I'm trying to come to the point.
I refuse to give up my obsession.
America stop pushing I know what I'm doing.
America the plum blossoms are falling.
I haven't read the newspapers for months, everyday
somebody goes on trial for murder.
America I feel sentimental about the Wobblies.
America I used to be a communist when I was a kid
I'm not sorry.
I smoke marijuana every chance I get.
I sit in my house for days on end and stare at the roses
in the closet.
When I go to Chinatown I get drunk and never get laid.
My mind is made up there's going to be trouble.
You should have seen me reading Marx.
My psychoanalyst thinks I'm perfectly right.
I won't say the Lord's Prayer.
I have mystical visions and cosmic vibrations.
America I still haven't told you what you did to Uncle
Max after he came over from Russia.
I'm addressing you.
Are you going to let your emotional life be run by
Time Magazine?
I'm obsessed by Time Magazine.
I read it every week.
Its cover stares at me every time I slink past the corner
candystore.
I read it in the basement of the Berkeley Public Library.
It's always telling me about responsibility. Business-
men are serious. Movie producers are serious.
Everybody's serious but me.
It occurs to me that I am America.
I am talking to myself again. 
Asia is rising against me.
I haven't got a chinaman's chance.
I'd better consider my national resources.
My national resources consist of two joints of
marijuana millions of genitals an unpublishable
private literature that goes 1400 miles an hour
and twenty-five-thousand mental institutions.
I say nothing about my prisons nor the millions of
underprivileged who live in my flowerpots
under the light of five hundred suns.
I have abolished the whorehouses of France, Tangiers
is the next to go.
My ambition is to be President despite the fact that
I'm a Catholic.
America how can I write a holy litany in your silly
mood?
I will continue like Henry Ford my strophes are as
individual as his automobiles more so they're
all different sexes.
America I will sell you strophes $2500 apiece $500
down on your old strophe
America free Tom Mooney
America save the Spanish Loyalists
America Sacco & Vanzetti must not die
America I am the Scottsboro boys.
America when I was seven momma took me to Com-
munist Cell meetings they sold us garbanzos a
handful per ticket a ticket costs a nickel and the
speeches were free everybody was angelic and
sentimental about the workers it was all so sin-
cere you have no idea what a good thing the
party was in 1835 Scott Nearing was a grand
old man a real mensch Mother Bloor made me
cry I once saw Israel Amter plain. Everybody
must have been a spy.
America you don't really want to go to war.
America it's them bad Russians.
Them Russians them Russians and them Chinamen.
And them Russians.
The Russia wants to eat us alive. The Russia's power
mad. She wants to take our cars from out our
garages.
Her wants to grab Chicago. Her needs a Red Readers'
Digest. Her wants our auto plants in Siberia.
Him big bureaucracy running our fillingsta-
tions.
That no good. Ugh. Him make Indians learn read.
Him need big black niggers. Hah. Her make us
all work sixteen hours a day. Help.
America this is quite serious.
America this is the impression I get from looking in
the television set.
America is this correct?
I'd better get right down to the job.
It's true I don't want to join the Army or turn lathes
in precision parts factories, I'm nearsighted and
psychopathic anyway.
America I'm putting my queer shoulder to the wheel."
9,Charles Bukowski,And The Moon And The Stars And The World,"Long walks at night--
that's what good for the soul:
peeking into windows
watching tired housewives
trying to fight off
their beer-maddened husbands."
10,Edgar Allan Poe,Annabel Lee,"It was many and many a year ago,
In a kingdom by the sea,
That a maiden there lived whom you may know
By the name of Annabel Lee;
And this maiden she lived with no other thought
Than to love and be loved by me. 
I was a child and she was a child,
In this kingdom by the sea;
But we loved with a love that was more than love-
I and my Annabel Lee;
With a love that the winged seraphs of heaven
Coveted her and me. 
And this was the reason that, long ago,
In this kingdom by the sea,
A wind blew out of a cloud, chilling
My beautiful Annabel Lee;
So that her highborn kinsman came
And bore her away from me,
To shut her up in a sepulchre
In this kingdom by the sea. 
The angels, not half so happy in heaven,
Went envying her and me-
Yes!- that was the reason (as all men know,
In this kingdom by the sea)
That the wind came out of the cloud by night,
Chilling and killing my Annabel Lee. 
But our love it was stronger by far than the love
Of those who were older than we-
Of many far wiser than we-
And neither the angels in heaven above,
Nor the demons down under the sea,
Can ever dissever my soul from the soul
Of the beautiful Annabel Lee. 
For the moon never beams without bringing me dreams
Of the beautiful Annabel Lee;
And the stars never rise but I feel the bright eyes
Of the beautiful Annabel Lee;
And so, all the night-tide, I lie down by the side
Of my darling- my darling- my life and my bride,
In the sepulchre there by the sea,
In her tomb by the sounding sea."
11,Jack Prelutsky,As Soon as Fred Gets Out of Bed,"As soon as Fred gets out of bed,
his underwear goes on his head.
His mother laughs, ""Don't put it there,
a head's no place for underwear!""
But near his ears, above his brains,
is where Fred's underwear remains.
At night when Fred goes back to bed,
he deftly plucks it off his head.
His mother switches off the light
and softly croons, ""Good night! Good night!""
And then, for reasons no one knows,
Fred's underwear goes on his toes."
12,James Wright,"Autumn Begins in Martins Ferry, Ohio","In the Shreve High football stadium,
I think of Polacks nursing long beers in Tiltonsville,
And gray faces of Negroes in the blast furnace at Benwood,
And the ruptured night watchman of Wheeling Steel,
Dreaming of heroes.
All the proud fathers are ashamed to go home.
Their women cluck like starved pullets,
Dying for love.
Therefore,
Their sons grow suicidally beautiful
At the beginning of October,
And gallop terribly against each other's bodies."
13,Jack Prelutsky,Be Glad Your Nose is on Your Face,"Be glad your nose is on your face,
not pasted on some other place,
for if it were where it is not,
you might dislike your nose a lot.
Imagine if your precious nose
were sandwiched in between your toes,
that clearly would not be a treat,
for you'd be forced to smell your feet.
Your nose would be a source of dread
were it attached atop your head,
it soon would drive you to despair,
forever tickled by your hair.
Within your ear, your nose would be
an absolute catastrophe,
for when you were obliged to sneeze,
your brain would rattle from the breeze.
Your nose, instead, through thick and thin,
remains between your eyes and chin,
not pasted on some other place--
be glad your nose is on your face!"
14,Shel Silverstein,Bear In There,"There's a Polar Bear
In our Frigidaire--
He likes it 'cause it's cold in there.
With his seat in the meat
And his face in the fish
And his big hairy paws
In the buttery dish,
He's nibbling the noodles,
He's munching the rice,
He's slurping the soda,
He's licking the ice.
And he lets out a roar
If you open the door.
And it gives me a scare
To know he's in there--
That Polary Bear
In our Fridgitydaire."
15,Robert Frost,Birches,"When I see birches bend to left and right
Across the lines of straighter darker trees,
I like to think some boy's been swinging them.
But swinging doesn't bend them down to stay
As ice-storms do.  Often you must have seen them
Loaded with ice a sunny winter morning
After a rain.  They click upon themselves
As the breeze rises, and turn many-colored
As the stir cracks and crazes their enamel.
Soon the sun's warmth makes them shed crystal shells
Shattering and avalanching on the snow-crust--
Such heaps of broken glass to sweep away
You'd think the inner dome of heaven had fallen.
They are dragged to the withered bracken by the load,
And they seem not to break; though once they are bowed
So low for long, they never right themselves:
You may see their trunks arching in the woods
Years afterwards, trailing their leaves on the ground
Like girls on hands and knees that throw their hair
Before them over their heads to dry in the sun.
But I was going to say when Truth broke in
With all her matter-of-fact about the ice-storm
I should prefer to have some boy bend them
As he went out and in to fetch the cows--
Some boy too far from town to learn baseball,
Whose only play was what he found himself,
Summer or winter, and could play alone.
One by one he subdued his father's trees
By riding them down over and over again
Until he took the stiffness out of them,
And not one but hung limp, not one was left
For him to conquer.  He learned all there was
To learn about not launching out too soon
And so not carrying the tree away
Clear to the ground.  He always kept his poise
To the top branches, climbing carefully
With the same pains you use to fill a cup
Up to the brim, and even above the brim.
Then he flung outward, feet first, with a swish,
Kicking his way down through the air to the ground.
So was I once myself a swinger of birches.
And so I dream of going back to be.
It's when I'm weary of considerations,
And life is too much like a pathless wood
Where your face burns and tickles with the cobwebs
Broken across it, and one eye is weeping
From a twig's having lashed across it open.
I'd like to get away from earth awhile
And then come back to it and begin over.
May no fate willfully misunderstand me
And half grant what I wish and snatch me away
Not to return.  Earth's the right place for love:
I don't know where it's likely to go better.
I'd like to go by climbing a birch tree,
And climb black branches up a snow-white trunk
Toward heaven, till the tree could bear no more,
But dipped its top and set me down again.
That would be good both going and coming back.
One could do worse than be a swinger of birches."
16,William Butler Yeats,Brown Penny,"I whispered, 'I am too young,'
And then, 'I am old enough';
Wherefore I threw a penny
To find out if I might love.
'Go and love, go and love, young man,
If the lady be young and fair.'
Ah, penny, brown penny, brown penny,
I am looped in the loops of her hair.
O love is the crooked thing,
There is nobody wise enough
To find out all that is in it,
For he would be thinking of love
Till the stars had run away
And the shadows eaten the moon.
Ah, penny, brown penny, brown penny,
One cannot begin it too soon."
17,Alfred Lord Tennyson,By An Evolutionist,"The Lord let the house of a brute to the soul of a man,
And the man said, ‘Am I your debtor?’
And the Lord-‘Not yet; but make it as clean as you can,
And then I will let you a better.’ 
I.
If my body come from brutes, my soul uncertain or a fable,
Why not bask amid the senses while the sun of morning shines,
I, the finer brute rejoicing in my hounds, and in my stable,
Youth and health, and birth and wealth, and choice of women and of wines? 
II.
What hast thou done for me, grim Old Age,
save breaking my bones on the rack?
Would I had past in the morning that looks so bright from afar! 
OLD AGE 
Done for thee? starved the wild beast that was linkt with thee eighty years back.
Less weight now for the ladder-of-heaven that hangs on a star. 
I.
If my body come from brutes, tho’ somewhat finer than their own,
I am heir, and this my kingdom. Shall the royal voice be mute?
No, but if the rebel subject seek to drag me from the throne,
Hold the sceptre, Human Soul, and rule thy province of the brute. 
II.
I have climb’d to the snows of Age, and I gaze at a field in the Past.
Where I sank with the body at times in the sloughs of a low desire,
But I hear no yelp of the beast, and the Man is quiet at last,
As he stands on the heights of his life with a glimpse of a height that is higher."
18,Sylvia Plath,Daddy,"You do not do, you do not do
Any more, black shoe
In which I have lived like a foot
For thirty years, poor and white,
Barely daring to breathe or Achoo.
Daddy, I have had to kill you.
You died before I had time--
Marble-heavy, a bag full of God,
Ghastly statue with one gray toe
Big as a Frisco seal
And a head in the freakish Atlantic
Where it pours bean green over blue
In the waters off beautiful Nauset.
I used to pray to recover you.
Ach, du.
In the German tongue, in the Polish town
Scraped flat by the roller
Of wars, wars, wars.
But the name of the town is common.
My Polack friend
Says there are a dozen or two.
So I never could tell where you
Put your foot, your root,
I never could talk to you.
The tongue stuck in my jaw.
It stuck in a barb wire snare.
Ich, ich, ich, ich,
I could hardly speak.
I thought every German was you.
And the language obscene
An engine, an engine
Chuffing me off like a Jew.
A Jew to Dachau, Auschwitz, Belsen.
I began to talk like a Jew.
I think I may well be a Jew.
The snows of the Tyrol, the clear beer of Vienna
Are not very pure or true.
With my gipsy ancestress and my weird luck
And my Taroc pack and my Taroc pack
I may be a bit of a Jew.
I have always been scared of you,
With your Luftwaffe, your gobbledygoo.
And your neat mustache
And your Aryan eye, bright blue.
Panzer-man, panzer-man, O You-- 
Not God but a swastika
So black no sky could squeak through.
Every woman adores a Fascist,
The boot in the face, the brute
Brute heart of a brute like you.
You stand at the blackboard, daddy,
In the picture I have of you,
A cleft in your chin instead of your foot
But no less a devil for that, no not
Any less the black man who
Bit my pretty red heart in two.
I was ten when they buried you.
At twenty I tried to die
And get back, back, back to you.
I thought even the bones would do.
But they pulled me out of the sack,
And they stuck me together with glue.
And then I knew what to do.
I made a model of you,
A man in black with a Meinkampf look
And a love of the rack and the screw.
And I said I do, I do.
So daddy, I'm finally through.
The black telephone's off at the root,
The voices just can't worm through.
If I've killed one man, I've killed two--
The vampire who said he was you
And drank my blood for a year,
Seven years, if you want to know.
Daddy, you can lie back now.
There's a stake in your fat black heart
And the villagers never liked you.
They are dancing and stamping on you.
They always knew it was you.
Daddy, daddy, you bastard, I'm through."
19,Dylan Thomas,Deaths And Entrances,"On almost the incendiary eve
Of several near deaths,
When one at the great least of your best loved
And always known must leave
Lions and fires of his flying breath,
Of your immortal friends
Who'd raise the organs of the counted dust
To shoot and sing your praise,
One who called deepest down shall hold his peace
That cannot sink or cease
Endlessly to his wound
In many married London's estranging grief.
On almost the incendiary eve
When at your lips and keys,
Locking, unlocking, the murdered strangers weave,
One who is most unknown,
Your polestar neighbour, sun of another street,
Will dive up to his tears.
He'll bathe his raining blood in the male sea
Who strode for your own dead
And wind his globe out of your water thread
And load the throats of shells
with every cry since light
Flashed first across his thunderclapping eyes.
On almost the incendiary eve
Of deaths and entrances,
When near and strange wounded on London's waves
Have sought your single grave,
One enemy, of many, who knows well
Your heart is luminous
In the watched dark, quivering through locks and caves,
Will pull the thunderbolts
To shut the sun, plunge, mount your darkened keys
And sear just riders back,
Until that one loved least
Looms the last Samson of your zodiac."
20,Robert Louis Stevenson,Dedication,"My first gift and my last, to you
I dedicate this fascicle of songs -
The only wealth I have:
Just as they are, to you. 
I speak the truth in soberness, and say
I had rather bring a light to your clear eyes,
Had rather hear you praise
This bosomful of songs 
Than that the whole, hard world with one consent,
In one continuous chorus of applause
Poured forth for me and mine
The homage of ripe praise. 
I write the finis here against my love,
This is my love's last epitaph and tomb.
Here the road forks, and I
Go my way, far from yours."
21,Seamus Heaney,Digging,"Between my finger and my thumb
The squat pin rest; snug as a gun.
Under my window, a clean rasping sound
When the spade sinks into gravelly ground:
My father, digging. I look down
Till his straining rump among the flowerbeds
Bends low, comes up twenty years away
Stooping in rhythm through potato drills
Where he was digging.
The coarse boot nestled on the lug, the shaft
Against the inside knee was levered firmly.
He rooted out tall tops, buried the bright edge deep
To scatter new potatoes that we picked,
Loving their cool hardness in our hands.
By God, the old man could handle a spade.
Just like his old man.
My grandfather cut more turf in a day
Than any other man on Toner's bog.
Once I carried him milk in a bottle
Corked sloppily with paper. He straightened up
To drink it, then fell to right away
Nicking and slicing neatly, heaving sods
Over his shoulder, going down and down
For the good turf. Digging.
The cold smell of potato mould, the squelch and slap
Of soggy peat, the curt cuts of an edge
Through living roots awaken in my head.
But I've no spade to follow men like them.
Between my finger and my thumb
The squat pen rests.
I'll dig with it."
22,Dylan Thomas,Do not go gentle into that good night,"Do not go gentle into that good night,
Old age should burn and rave at close of day;
Rage, rage against the dying of the light.
Though wise men at their end know dark is right,
Because their words had forked no lightning they
Do not go gentle into that good night.
Good men, the last wave by, crying how bright
Their frail deeds might have danced in a green bay,
Rage, rage against the dying of the light.
Wild men who caught and sang the sun in flight,
And learn, too late, they grieved it on its way,
Do not go gentle into that good night.
Grave men, near death, who see with blinding sight
Blind eyes could blaze like meteors and be gay,
Rage, rage against the dying of the light.
And you, my father, there on the sad height,
Curse, bless, me now with your fierce tears, I pray.
Do not go gentle into that good night.
Rage, rage against the dying of the light."
23,Matthew Arnold,Dover Beach,"The sea is calm to-night.
The tide is full, the moon lies fair
Upon the straits; on the French coast the light
Gleams and is gone; the cliffs of England stand,
Glimmering and vast, out in the tranquil bay.
Come to the window, sweet is the night-air!
Only, from the long line of spray
Where the sea meets the moon-blanch'd land,
Listen! you hear the grating roar
Of pebbles which the waves draw back, and fling,
At their return, up the high strand,
Begin, and cease, and then again begin,
With tremulous cadence slow, and bring
The eternal note of sadness in. 
Sophocles long ago
Heard it on the Agean, and it brought
Into his mind the turbid ebb and flow
Of human misery; we
Find also in the sound a thought,
Hearing it by this distant northern sea. 
The Sea of Faith
Was once, too, at the full, and round earth's shore
Lay like the folds of a bright girdle furl'd.
But now I only hear
Its melancholy, long, withdrawing roar,
Retreating, to the breath
Of the night-wind, down the vast edges drear
And naked shingles of the world. 
Ah, love, let us be true
To one another! for the world, which seems
To lie before us like a land of dreams,
So various, so beautiful, so new,
Hath really neither joy, nor love, nor light,
Nor certitude, nor peace, nor help for pain;
And we are here as on a darkling plain
Swept with confused alarms of struggle and flight,
Where ignorant armies clash by night."
24,Langston Hughes,Dream Deferred,"What happens to a dream deferred?
Does it dry up
Like a raisin in the sun?
Or fester like a sore--
And then run?
Does it stink like rotten meat?
Or crust and sugar over--
like a syrupy sweet?
Maybe it just sags
like a heavy load.
Or does it explode?"
