,Author,Title,Poem
50,Henry Lawson,One Hundred and Three,"With the frame of a man, and the face of a boy, and a manner strangely wild,
And the great, wide, wondering, innocent eyes of a silent-suffering child;
With his hideous dress and his heavy boots, he drags to Eternity—
And the Warder says, in a softened tone: ‘Keep step, One Hundred and Three.’ 
’Tis a ghastly travesty of drill—or a ghastly farce of work—
But One Hundred and Three, he catches step with a start, a shuffle and jerk.
’Tis slow starvation in separate cells, and a widow’s son is he,
And the widow, she drank before he was born—(Keep step, One Hundred and Three!) 
They shut a man in the four-by-eight, with a six-inch slit for air,
Twenty-three hours of the twenty-four, to brood on his virtues there.
And the dead stone walls and the iron door close in as an iron band
On eyes that followed the distant haze far out on the level land. 
Bread and water and hominy, and a scrag of meat and a spud,
A Bible and thin flat book of rules, to cool a strong man’s blood;
They take the spoon from the cell at night—and a stranger might think it odd;
But a man might sharpen it on the floor, and go to his own Great God. 
One Hundred and Three, it is hard to believe that you saddled your horse at dawn;
There were girls that rode through the bush at eve, and girls who lolled on the lawn.
There were picnic parties in sunny bays, and ships on the shining sea;
There were foreign ports in the glorious days—(Hold up, One Hundred and Three!) 
A man came out at exercise time from one of the cells to-day:
’Twas the ghastly spectre of one I knew, and I thought he was far away;
We dared not speak, but he signed ‘Farewell—fare—well,’ and I knew by this
And the number stamped on his clothes (not sewn) that a heavy sentence was his.
Where five men do the work of a boy, with warders not to see,
It is sad and bad and uselessly mad, it is ugly as it can be,
From the flower-beds laid to fit the gaol, in circle and line absurd,
To the gilded weathercock on the church, agape like a strangled bird. 
Agape like a strangled bird in the sun, and I wonder what he could see?
The Fleet come in, and the Fleet go out? (Hold up, One Hundred and Three!)
The glorious sea, and the bays and Bush, and the distant mountains blue
(Keep step, keep step, One Hundred and Three, for my lines are halting too) 
The great, round church with its volume of sound, where we dare not turn our eyes—
They take us there from our separate hells to sing of Paradise.
In all the creeds there is hope and doubt, but of this there is no doubt:
That starving prisoners faint in church, and the warders carry them out. 
They double-lock at four o’clock and the warders leave their keys,
And the Governor strolls with a friend at eve through his stone conservatories;
Their window slits are like idiot mouths with square stone chins adrop,
And the weather-stains for the dribble, and the dead flat foreheads atop. 
No light save the lights in the yard beneath the clustering lights of the Lord—
And the lights turned in to the window slits of the Observation Ward.
(They eat their meat with their fingers there in a madness starved and dull—
Oh! the padded cells and the O—b—s are nearly always full.) 
Rules, regulations—red-tape and rules; all and alike they bind:
Under ‘separate treatment ’ place the deaf; in the dark cell shut the blind!
And somewhere down in his sandstone tomb, with never a word to save,
One Hundred and Three is keeping step, as he’ll keep it to his grave. 
The press is printing its smug, smug lies, and paying its shameful debt—
It speaks of the comforts that prisoners have, and ‘holidays’ prisoners get.
The visitors come with their smug, smug smiles through the gaol on a working day,
And the public hears with its large, large ears what authorities have to say. 
They lay their fingers on well-hosed walls, and they tread on the polished floor;
They peep in the generous shining cans with their ration Number Four.
And the visitors go with their smug, smug smiles; the reporters’ work is done;
Stand up! my men, who have done your time on ration Number One! 
Speak up, my men! I was never the man to keep my own bed warm,
I have jogged with you round in the Fools’ Parade, and I’ve worn your uniform;
I’ve seen you live, and I’ve seen you die, and I’ve seen your reason fail—
I’ve smuggled tobacco and loosened my tongue—and I’ve been punished in gaol.
Ay! clang the spoon on the iron floor, and shove in the bread with your toe,
And shut with a bang the iron door, and clank the bolt—just so,
With an ignorant oath for a last good-night—or the voice of a filthy thought.
By the Gipsy Blood you have caught a man you’ll be sorry that ever you caught.
He shall be buried alive without meat, for a day and a night unheard
If he speak to a fellow prisoner, though he die for want of a word.
He shall be punished, and he shall be starved, and he shall in darkness rot,
He shall be murdered body and soul—and God said, ‘Thou shalt not!’ 
I’ve seen the remand-yard men go out, by the subway out of the yard—
And I’ve seen them come in with a foolish grin and a sentence of Three Years Hard.
They send a half-starved man to the court, where the hearts of men they carve—
Then feed him up in the hospital to give him the strength to starve. 
You get the gaol-dust in your throat, in your skin the dead gaol-white;
You get the gaol-whine in your voice and in every letter you write.
And in your eyes comes the bright gaol-light—not the glare of the world’s distraught,
Not the hunted look, nor the guilty look, but the awful look of the Caught. 
There was one I met—’twas a mate of mine—in a gaol that is known to us;
He died—and they said it was ‘heart disease’; but he died for want of a truss.
I’ve knelt at the head of the pallid dead, where the living dead were we,
And I’ve closed the yielding lids with my thumbs—(Keep step, One Hundred and Three!) 
A criminal face is rare in gaol, where all things else are ripe—
It is higher up in the social scale that you’ll find the criminal type.
But the kindness of man to man is great when penned in a sandstone pen—
The public call us the ‘criminal class,’ but the warders call us ‘the men.’ 
The brute is a brute, and a kind man kind, and the strong heart does not fail—
A crawler’s a crawler everywhere, but a man is a man in gaol!
For forced ‘desertion’ or drunkenness, or a law’s illegal debt,
While never a man who was a man was ‘reformed’ by punishment yet. 
The champagne lady comes home from the course in charge of the criminal swell—
They carry her in from the motor car to the lift in the Grand Hotel.
But armed with the savage Habituals Act they are waiting for you and me,
And the drums, they are beating loud and near. (Keep step, One Hundred and Three!) 
The clever scoundrels are all outside, and the moneyless mugs in gaol—
Men do twelve months for a mad wife’s lies or Life for a strumpet’s tale.
If the people knew what the warders know, and felt as the prisoners feel—
If the people knew, they would storm their gaols as they stormed the old Bastile. 
And the cackling, screaming half-human hens who were never mothers nor wives
Would send their sisters to such a hell for the term of their natural lives,
Where laws are made in a Female Fit in the Land of the Crazy Fad,
And drunkards in judgment on drunkards sit and the mad condemn the mad.
The High Church service swells and swells where the tinted Christs look down—
It is easy to see who is weary and faint and weareth the thorny crown.
There are swift-made signs that are not to God, and they march us Hellward then.
It is hard to believe that we knelt as boys to ‘for ever and ever, Amen. ’ 
Warders and prisoners all alike in a dead rot dry and slow—
The author must not write for his own, and the tailor must not sew.
The billet-bound officers dare not speak and discharged men dare not tell
Though many and many an innocent man must brood in this barren hell. 
We are most of us criminal, most of us mad, and we do what we can do.
(Remember the Observation Ward and Number Forty-Two.)
There are eyes that see through stone and iron, though the rest of the world be blind—
We are prisoners all in God’s Great Gaol, but the Governor, He is kind. 
They crave for sunlight, they crave for meat, they crave for the might-have-been,
But the cruellest thing in the walls of a gaol is the craving for nicotine.
Yet the spirit of Christ is everywhere where the heart of a man can dwell,
It comes like tobacco in prison—or like news to the separate cell. 
. They have smuggled him out to the Hospital with no one to tell the tale,
But it’s little the doctors and nurses can do for the patient from Starvinghurst Gaol.
He cannot swallow the food they bring, for a gaol-starved man is he,
And the blanket and screen are ready to draw—(Keep step, One Hundred and Three!) 
‘What were you doing, One Hundred and Three?’ and the answer is ‘Three years hard,
And a month to go’—and the whisper is low: ‘There’s the moonlight—out in the yard.’
The drums, they are beating far and low, and the footstep’s light and free,
And the angels are whispering over his bed: ‘Keep step, One Hundred and Three!’"
51,Maya Angelou,Phenomenal Woman,"Pretty women wonder where my secret lies.
I'm not cute or built to suit a fashion model's size
But when I start to tell them,
They think I'm telling lies.
I say,
It's in the reach of my arms
The span of my hips,
The stride of my step,
The curl of my lips.
I'm a woman
Phenomenally.
Phenomenal woman,
That's me.
I walk into a room
Just as cool as you please,
And to a man,
The fellows stand or
Fall down on their knees.
Then they swarm around me,
A hive of honey bees.
I say,
It's the fire in my eyes,
And the flash of my teeth,
The swing in my waist,
And the joy in my feet.
I'm a woman
Phenomenally.
Phenomenal woman,
That's me.
Men themselves have wondered
What they see in me.
They try so much
But they can't touch
My inner mystery.
When I try to show them
They say they still can't see.
I say,
It's in the arch of my back,
The sun of my smile,
The ride of my breasts,
The grace of my style.
I'm a woman
Phenomenally.
Phenomenal woman,
That's me.
Now you understand
Just why my head's not bowed.
I don't shout or jump about
Or have to talk real loud.
When you see me passing
It ought to make you proud.
I say,
It's in the click of my heels,
The bend of my hair,
the palm of my hand,
The need of my care,
'Cause I'm a woman
Phenomenally.
Phenomenal woman,
That's me."
52,Edgar Allan Poe,Romance,"Romance, who loves to nod and sing
With drowsy head and folded wing
Among the green leaves as they shake
Far down within some shadowy lake,
To me a painted paroquet
Hath been—most familiar bird—
Taught me my alphabet to say,
To lisp my very earliest word
While in the wild wood I did lie,
A child—with a most knowing eye.
Of late, eternal condor years
So shake the very Heaven on high
With tumult as they thunder by,
I have no time for idle cares
Through gazing on the unquiet sky;
And when an hour with calmer wings
Its down upon my spirit flings,
That little time with lyre and rhyme
To while away—forbidden things—
My heart would feel to be a crime
Unless it trembled with the strings."
53,E. E. Cummings,Seeker Of Truth,"seeker of truth
follow no path
all paths lead where
truth is here"
54,William Shakespeare,Seven Ages Of Man,"All the world's a stage,
And all the men and women merely players,
They have their exits and entrances,
And one man in his time plays many parts,
His acts being seven ages. At first the infant,
Mewling and puking in the nurse's arms.
Then, the whining schoolboy with his satchel
And shining morning face, creeping like snail
Unwillingly to school. And then the lover,
Sighing like furnace, with a woeful ballad
Made to his mistress' eyebrow. Then a soldier,
Full of strange oaths, and bearded like the pard,
Jealous in honour, sudden, and quick in quarrel,
Seeking the bubble reputation
Even in the cannon's mouth. And then the justice
In fair round belly, with good capon lin'd,
With eyes severe, and beard of formal cut,
Full of wise saws, and modern instances,
And so he plays his part. The sixth age shifts
Into the lean and slipper'd pantaloon,
With spectacles on nose, and pouch on side,
His youthful hose well sav'd, a world too wide,
For his shrunk shank, and his big manly voice,
Turning again towards childish treble, pipes
And whistles in his sound. Last scene of all,
That ends this strange eventful history,
Is second childishness and mere oblivion,
Sans teeth, sans eyes, sans taste, sans everything."
55,Shel Silverstein,Sick,"""I cannot go to school today,""
Said little Peggy Ann McKay,
""I have the measles and the mumps,
A gash, a rash, and purple bumps.
My mouth is wet, my throat is dry,
I'm going blind in my right eye.
My tonsils are as big as rocks,
I've counted sixteen chicken pox
And there's one more--that's seventeen,
And don't you think my face looks green?
My leg is cut, my eyes are blue--
It might be instamatic flu.
I cough and sneeze and gasp and choke,
I'm sure that my left leg is broke--
My hip hurts when I move my chin,
My belly button's caving in,
My back is wrenched, my ankle's sprained,
My 'pendix pains each time it rains.
My nose is cold, my toes are numb,
I have a sliver in my thumb.
My neck is stiff, my voice is weak,
I hardly whisper when I speak.
My tongue is filling up my mouth,
I think my hair is falling out.
My elbow's bent, my spine ain't straight,
My temperature is one-o-eight.
My brain is shrunk, I cannot hear,
There is a hole inside my ear.
I have a hangnail, and my heart is--what?
What's that? What's that you say?
You say today is---Saturday?
G'bye, I'm going out to play!"""
56,Maya Angelou,Still I Rise,"You may write me down in history
With your bitter, twisted lies,
You may trod me in the very dirt
But still, like dust, I'll rise.
Does my sassiness upset you?
Why are you beset with gloom?
'Cause I walk like I've got oil wells
Pumping in my living room.
Just like moons and like suns,
With the certainty of tides,
Just like hopes springing high,
Still I'll rise.
Did you want to see me broken?
Bowed head and lowered eyes?
Shoulders falling down like teardrops.
Weakened by my soulful cries.
Does my haughtiness offend you?
Don't you take it awful hard
'Cause I laugh like I've got gold mines
Diggin' in my own back yard.
You may shoot me with your words,
You may cut me with your eyes,
You may kill me with your hatefulness,
But still, like air, I'll rise.
Does my sexiness upset you?
Does it come as a surprise
That I dance like I've got diamonds
At the meeting of my thighs?
Out of the huts of history's shame
I rise
Up from a past that's rooted in pain
I rise
I'm a black ocean, leaping and wide,
Welling and swelling I bear in the tide.
Leaving behind nights of terror and fear
I rise
Into a daybreak that's wondrously clear
I rise
Bringing the gifts that my ancestors gave,
I am the dream and the hope of the slave.
I rise
I rise
I rise."
57,Robert Frost,Stopping by Woods on a Snowy Evening,"Whose woods these are I think I know.
His house is in the village, though;
He will not see me stopping here
To watch his woods fill up with snow.
My little horse must think it queer
To stop without a farmhouse near
Between the woods and frozen lake
The darkest evening of the year.
He gives his harness bells a shake
To ask if there is some mistake.
The only other sound's the sweep
Of easy wind and downy flake.
The woods are lovely, dark and deep,
But I have promises to keep,
And miles to go before I sleep,
And miles to go before I sleep."
58,Emily Dickinson,Success Is Counted Sweetest,"Success is counted sweetest
By those who ne'er succeed.
To comprehend a nectar
Requires sorest need. 
Not one of all the purple Host
Who took the Flag today
Can tell the definition
So clear of Victory 
As he defeated-dying
On whose forbidden ear
The distant strains of triumph
Burst agonized and clear!"
59,Dante Gabriel Rossetti,The Blessed Damozel,"The blessed damozel leaned out
From the gold bar of Heaven;
Her eyes were deeper than the depth
Of waters stilled at even;
She had three lilies in her hand,
And the stars in her hair were seven.
Her robe, ungirt from clasp to hem,
No wrought flowers did adorn,
But a white rose of Mary's gift,
For service meetly worn;
Her hair that lay along her back
Was yellow like ripe corn.
Herseemed she scarce had been a day
One of God's choristers;
The wonder was not yet quite gone
From that still look of hers;
Albeit, to them she left, her day
Had counted as ten years.
(To one, it is ten years of years.
...Yet now, and in this place,
Surely she leaned o'er me -her hair
Fell all about my face...
Nothing: the autumn-fall of leaves.
The whole year sets apace.)
It was the rampart of God's house
That she was standing on;
By God built over the sheer depth
The which is Space begun;
So high, that looking downward thence
She scarce could see the sun.
It lies in Heaven, across the flood
Of ether, as a bridge.
Beneath, the tides of day and night
With flame and darkness ridge
The void, as low as where this earth
Spins like a fretful midge.
Around her, lovers, newly met
Mid deathless love's acclaims,
Spoke evermore among themselves
Their heart-remembered names;
And the souls mounting up to God
Went by her like thin flames.
And still she bowed herself and stooped
Out of the circling charm;
Until her bosom must have made
The bar she leaned on warm,
And the lilies lay as if asleep
Along her bended arm.
From the fixed place of Heaven she saw
Time like a pulse shake fierce
Through all the worlds. Her gaze still strove
Within the gulf to pierce
Its path; and now she spoke as when
The stars sang in their spheres.
The sun was gone now; the curled moon
Was like a little feather
Fluttering far down the gulf; and now
She spoke through the still weather.
Her voice was like the voice the stars
Had when they sang together.
(Ah sweet! Even now, in that bird's song,
Strove not her accents there,
Fain to be hearkened? When those bells
Possessed the midday air,
Strove not her steps to reach my side
Down all the echoing stair?)
""I wish that he were come to me,
For he will come,"" she said.
""Have I not prayed in Heaven? -on earth,
Lord, Lord, has he not prayed?
Are not two prayers a perfect strength?
And shall I feel afraid?
""When round his head the aureole clings,
And he is clothed in white,
I'll take his hand and go with him
To the deep wells of light;
As unto a stream we will step down,
And bathe there in God's sight.
""We two will stand beside that shrine,
Occult, withheld, untrod,
Whose lamps are stirred continually
With prayer sent up to God;
And see our old prayers, granted, melt
Each like a little cloud.
""We two will lie i' the shadow of
That living mystic tree
Within whose secret growth the Dove
Is sometimes felt to be,
While every leaf that His plumes touch
Saith His Name audibly.
""And I myself will teach to him,
I myself, lying so,
The songs I sing here; with his voice
Shall pause in, hushed and slow,
And find some knowledge at each pause,
Or some new thing to know.""
(Alas! we two, we two, thou sayst!
Yea, one wast thou with me
That once of old. But shall God lift
To endless unity
The soul whose likeness with thy soul
Was but its love for thee?)
""We two,"" she said, ""will seek the groves
Where the lady Mary is,
With her five handmaidens, whose names
Are five sweet symphonies,
Cecily, Gertrude, Magdalen,
Margaret and Rosalys.
""Circlewise sit they, with bound locks
And foreheads garlanded;
Into the fine cloth white like flame
Weaving the golden thread,
To fashion the birth-robes for them
Who are just born, being dead.
""He shall fear, haply, and be dumb:
Then will I lay my cheek
To his, and tell about our love,
Not once abashed or weak:
And the dear Mother will approve
My pride, and let me speak.
""Herself shall bring us, hand in hand,
To Him round Whom all souls
Kneel, the clear-ranged unnumbered heads
Bowed with their aureoles:
And angels meeting us shall sing
To their citherns and citoles.
""There will I ask of Christ the Lord
Thus much for him and me: -
Only to live as once on earth
With Love, -only to be,
As then awhile, for ever now
Together, I and he.""
She gazed and listened and then said,
Less sad of speech than mild, -
""All this is when he comes."" She ceased.
The light thrilled towards her, filled
With angels in strong level flight.
Her eyes prayed, and she smiled.
(I saw her smile.) But soon their path
Was vague in distant spheres:
And then she cast her arms along
The golden barriers,
And laid her face between her hands,
And wept. (I heard her tears.)"
60,William Barnes,The Broken Heart,"News o' grief had overteaken
Dark-eyed Fanny, now vorseaken;
There she zot, wi' breast a-heaven,
While vrom zide to zide, wi' grieven,
Vell her head, wi' tears a-creepen
Down her cheaks, in bitter weepen.
There wer still the ribbon-bow
She tied avore her hour ov woe,
An' there wer still the hans that tied it
Hangen white,
Or wringen tight,
In ceare that drowned all ceare bezide it.
When a man, wi' heartless slighten,
Mid become a maiden's blighten,
He mid cearelessly vorseake her,
But must answer to her Meaker;
He mid slight, wi' selfish blindness,
All her deeds o' loven-kindness,
God wull waigh 'em wi' the slighten
That mid be her love's requiten;
He do look on each deceiver,
He do know
What weight o' woe
Do break the heart ov ev'ry griever."
61,Lord Alfred Tennyson,The Charge of the Light Brigade,"Half a league, half a league,
Half a league onward,
All in the valley of Death
Rode the six hundred.
""Forward, the Light Brigade!
Charge for the guns!"" he said:
Into the valley of Death
Rode the six hundred.
""Forward, the Light Brigade!""
Was there a man dismayed?
Not though the soldier knew
Some one had blundered:
Their's not to make reply,
Their's not to reason why,
Their's but to do and die:
Into the valley of Death
Rode the six hundred.
Cannon to right of them,
Cannon to left of them,
Cannon in front of them
Volleyed and thundered;
Stormed at with shot and shell,
Boldly they rode and well,
Into the jaws of Death,
Into the mouth of Hell
Rode the six hundred.
Flashed all their sabres bare,
Flashed as they turned in air
Sabring the gunners there,
Charging an army, while
All the world wondered:
Plunged in the battery-smoke
Right through the line they broke;
Cossack and Russian
Reeled from the sabre-stroke
Shattered and sundered.
Then they rode back, but not,
Not the six hundred.
Cannon to right of them,
Cannon to left of them,
Cannon behind them
Volleyed and thundered;
Stormed at with shot and shell,
While horse and hero fell,
They that had fought so well
Came through the jaws of Death
Back from the mouth of Hell,
All that was left of them,
Left of six hundred.
When can their glory fade?
O the wild charge they made!
All the world wondered.
Honour the charge they made!
Honour the Light Brigade,
Noble six hundred!"
62,Oscar Wilde,The Dole of the King's Daughter,"Seven stars in the still water,
And seven in the sky;
Seven sins on the King's daughter,
Deep in her soul to lie. 
Red roses at her feet,
(Roses are red in her red-gold hair)
And O where her bosom and girdle meet
Red roses are hidden there. 
Fair is the knight who lieth slain
Amid the rush and reed,
See the lean fishes that are fain
Upon dead men to feed. 
Sweet is the page that lieth there,
(Cloth of gold is goodly prey,)
See the black ravens in the air,
Black, O black as the night are they. 
What do they there so stark and dead?
(There is blood upon her hand)
Why are the lilies flecked with red?
(There is blood on the river sand.) 
There are two that ride from the south to the east,
And two from the north and west,
For the black raven a goodly feast,
For the King's daughter to rest. 
There is one man who loves her true,
(Red, O red, is the stain of gore!)
He hath duggen a grave by the darksome yew,
(One grave will do for four.) 
No moon in the still heaven,
In the black water none,
The sins on her soul are seven,
The sin upon his is one."
