,Author,Title,Poem,Form
21,Rainer Maria Rilke,The Sonnets To Orpheus: Book 2: Xxiii,"Call to me to the one among your moments
that stands against you, ineluctably:
intimate as a dog's imploring glance
but, again, forever, turned away

when you think you've captured it at last.
What seems so far from you is most your own.
We are already free, and were dismissed
where we thought we soon would be at home.

Anxious, we keep longing for a foothold-
we, at times too young for what is old
and too old for what has never been;

doing justice only where we praise,
because we are the branch, the iron blade,
and sweet danger, ripening from within.


Translated by Stephen Mitchell",Sonnet
22,Rainer Maria Rilke,The Sonnets To Orpheus: Iv,"O you tender ones, walk now and then
into the breath that blows coldly past,
Upon your cheeks let it tremble and part;
behind you it will tremble together again.

O you blessed ones, you who are whole,
you who seem the beginning of hearts,
bows for the arrows and arrows' targets--
tear-bright, your lips more eternally smile.

Don't be afraid to suffer; return
that heaviness to the earth's own weight;
heavy are the mountains, heavy the seas.

Even the small trees you planted as children
have long since become too heavy; you could not
carry them now. But the winds...But the spaces....


Translated by Stephen Mitchell",Sonnet
23,Rainer Maria Rilke,The Sonnets To Orpheus: Xxv,"But you now, dear girl, whom I loved like a flower whose
   name
I didn't know, you who so early were taken away:
I will once more call up your image and show it to them,
beautiful companion of the unsubduable cry.

Dancer whose body filled with your hesitant fate,
pausing, as though your young flesh had been cast in bronze;
grieving and listening--. Then, from the high dominions,
unearthly music fell into your altered heart.

Already possessed by shadows, with illness near,
your blood flowed darkly; yet, though for a moment
   suspicious,
it burst out into the natural pulses of spring.

Again and again interrupted by downfall and darkness,
earthly, it gleamed. Till, after a terrible pounding,
it entered the inconsolably open door.


Translated by Stephen Mitchell",Sonnet
24,Helen Hunt Jackson,A Calendar Of Sonnets: February,"Still lie the sheltering snows, undimmed and white; 
And reigns the winter's pregnant silence still; 
No sign of spring, save that the catkins fill, 
And willow stems grow daily red and bright. 
These are days when ancients held a rite 
Of expiation for the old year's ill, 
And prayer to purify the new year's will: 
Fit days, ere yet the spring rains blur the sight, 
Ere yet the bounding blood grows hot with haste, 
And dreaming thoughts grow heavy with a greed 
The ardent summer's joy to have and taste; 
Fit days, to give to last year's losses heed, 
To recon clear the new life's sterner need; 
Fit days, for Feast of Expiation placed!",Sonnet
25,John Donne,Holy Sonnets: Since She Whom I Lov'D Hat..,"Since she whom I lov'd hath paid her last debt
     To nature, and to hers, and my good is dead,
     And her soul early into heaven ravished,
     Wholly in heavenly things my mind is set.
     Here the admiring her my mind did whet
     To seek thee, God; so streams do show the head;
     But though I have found thee, and thou my thirst hast fed,
     A holy thirsty dropsy melts me yet.
     But why should I beg more love, whenas thou
   Dost woo my soul, for hers off'ring all thine,
   And dost not only fear lest I allow
   My love to saints and angels, things divine,
   But in thy tender jealousy dost doubt
   Lest the world, flesh, yea devil put thee out.",Sonnet
26,Elizabeth Barrett Browning,Sonnets From The Portuguese I,"I THOUGHT once how Theocritus had sung 
   Of the sweet years, the dear and wish'd-for years, 
   Who each one in a gracious hand appears 
To bear a gift for mortals old or young: 
And, as I mused it in his antique tongue, 
   I saw in gradual vision through my tears 
   The sweet, sad years, the melancholy years-- 
Those of my own life, who by turns had flung 
A shadow across me. Straightway I was 'ware, 
   So weeping, how a mystic Shape did move 
Behind me, and drew me backward by the hair; 
   And a voice said in mastery, while I strove, 
'Guess now who holds thee?'--'Death,' I said. But there 
   The silver answer rang--'Not Death, but Love.'",Sonnet
27,Edna St. Vincent Millay,Sonnets 09: Let You Not Say Of Me When I..,"Let you not say of me when I am old,
In pretty worship of my withered hands
Forgetting who I am, and how the sands
Of such a life as mine run red and gold
Even to the ultimate sifting dust, ""Behold,
Here walketh passionless age!""—for there expands
A curious superstition in these lands,
And by its leave some weightless tales are told.

In me no lenten wicks watch out the night;
I am the booth where Folly holds her fair;
Impious no less in ruin than in strength,
When I lie crumbled to the earth at length,
Let you not say, ""Upon this reverend site
The righteous groaned and beat their breasts in prayer.""",Sonnet
28,Edna St. Vincent Millay,Sonnets From An Ungrafted Tree,"XLI

I, being born a woman and distressed
By all the needs and notions of my kind,
Am urged by your propinquity to find
Your person fair, and feel a certain zest
To bear you body's weight upon my breast:
So subtly is the fume of life designed,
To clairfy the pulse and cloud the mind,
And leave me once again undone, possessed.
Think not for this, however, the poor treason
Of my stout blood against my staggering brain,
I shall remember you with love, or season
My scorn with pity,—let me make it plain:
I find ths frenzy insufficient reason
For conversation when we meet again.",Sonnet
29,Edna St. Vincent Millay,"Sonnets 08: And You As Well Must Die, Be..","And you as well must die, beloved dust,
And all your beauty stand you in no stead;
This flawless, vital hand, this perfect head,
This body of flame and steel, before the gust
Of Death, or under his autumnal frost,
Shall be as any leaf, be no less dead
Than the first leaf that fell,--this wonder fled.
Altered, estranged, disintegrated, lost.
Nor shall my love avail you in your hour.
In spite of all my love, you will arise
Upon that day and wander down the air
Obscurely as the unattended flower,
It mattering not how beautiful you were,
Or how beloved above all else that dies.",Sonnet
30,Rainer Maria Rilke,The Sonnets To Orpheus: Book 2: Vi,"Rose, you majesty-once, to the ancients, you were
just a calyx with the simplest of rims.
But for us, you are the full, the numberless flower,
the inexhaustible countenance.

In your wealth you seem to be wearing gown upon gown
upon a body of nothing but light;
yet each seperate petal is at the same time the negation
of all clothing and the refusal of it.

Your fragrance has been calling its sweetest names
in our direction, for hundreds of years;
suddenly it hangs in the air like fame.

Even so, we have never known what to call it; we guess...
And memory is filled with it unawares
which we prayed for from hours that belong to us.


Translated by Stephen Mitchell",Sonnet
31,Delmore Schwartz,Sonnet On Famous And Familiar Sonnets An..,"(With much help from Robert Good, William Shakespeare, 
John Milton, and little Catherine Schwartz) 


Shall I compare her to a summer play?
She is too clever, too devious, too subtle, too dark:
Her lies are rare, but then she paves the way
Beyond the summer's sway, within the jejune park
Where all souls' aspiration to true nobility
Obliges Statues in the Frieze of Death
And when this pantomime and Panama of Panorama Fails,
""I'll never speak to you agayne"" -- or waste her panting breath.

When I but think of how her years are spent
Deadening that one talent which -- for woman is --
Death or paralysis, denied: nature's intent
That each girl be a mother -- whether or not she is
Or has become a lawful wife or bride
-- 0 Alma Magna Mater, deathless the living death of pride.",Sonnet
32,Helen Hunt Jackson,A Calendar Of Sonnets: June,"O month whose promise and fulfilment blend, 
And burst in one! it seems the earth can store 
In all her roomy house no treasure more; 
Of all her wealth no farthing have to spend 
On fruit, when once this stintless flowering end. 
And yet no tiniest flower shall fall before 
It hath made ready at its hidden core 
Its tithe of seed, which we may count and tend 
Till harvest. Joy of blossomed love, for thee 
Seems it no fairer thing can yet have birth? 
No room is left for deeper ecstacy? 
Watch well if seeds grow strong, to scatter free 
Germs for thy future summers on the earth. 
A joy which is but joy soon comes to dearth.",Sonnet
33,Helen Hunt Jackson,A Calendar Of Sonnets: May,"O Month when they who love must love and wed! 
Were one to go to worlds where May is naught, 
And seek to tell the memories he had brought 
From earth of thee, what were most fitly said? 
I know not if the rosy showers shed 
From apple-boughs, or if the soft green wrought 
In fields, or if the robin's call be fraught 
The most with thy delight. Perhaps they read 
Thee best who in the ancient time did say 
Thou wert the sacred month unto the old: 
No blossom blooms upon thy brightest day 
So subtly sweet as memories which unfold 
In aged hearts which in thy sunshine lie, 
To sun themselves once more before they die.",Sonnet
34,Edna St. Vincent Millay,Sonnets (1923),"VIII8.
   Oh, oh, you will be sorry for that word! 
   Give back my book and take my kiss instead. 
   Was it my enemy or my friend I heard, 
   ""What a big book for such a little head!"" 
   Come, I will show you now my newest hat, 
   And you may watch me purse my mouth and prink! 
   Oh, I shall love you still, and all of that. 
   I never again shall tell you what I think. 
   I shall be sweet and crafty, soft and sly; 

  You will not catch me reading any more: 

  I shall be called a wife to pattern by; 

  And some day when you knock and push the door, 

  Some sane day, not too bright and not too stormy, 

  I shall be gone, and you may whistle for me. IX9.
   Here is a wound that never will heal, I know, 
   Being wrought not of a dearness and a death, 
   But of a love turned ashes and the breath 
   Gone out of beauty; never again will grow 
   The grass on that scarred acre, though I sow 
   Young seed there yearly and the sky bequeath 
   Its friendly weathers down, far underneath 
   Shall be such bitterness of an old woe. 
   That April should be shattered by a gust, 

  That August should be levelled by a rain, 

  I can endure, and that the lifted dust 

  Of man should settle to the earth again; 

  But that a dream can die, will be a thrust 

  Between my ribs forever of hot pain. XVIII18.
   I, being born a woman and distressed 
   By all the needs and notions of my kind, 
   Am urged by your propinquity to find 
   Your person fair, and feel a certain zest 
   To bear your body's weight upon my breast: 
   So subtly is the fume of life designed, 
   To clarify the pulse and cloud the mind, 
   And leave me once again undone, possessed. 
   Think not for this, however, the poor treason 

  Of my stout blood against my staggering brain, 

  I shall remember you with love, or season 

  My scorn with pity, -- let me make it plain: 

  I find this frenzy insufficient reason 

  For conversation when we meet again. XIX19.
   What lips my lips have kissed, and where, and why, 
   I have forgotten, and what arms have lain 
   Under my head till morning; but the rain 
   Is full of ghosts to-night, that tap and sigh 
   Upon the glass and listen for reply, 
   And in my heart there stirs a quiet pain 
   For unremembered lads that not again 
   Will turn to me at midnight with a cry. 
   Thus in the winter stands the lonely tree, 

  Nor knows what birds have vanished one by one, 

  Yet knows its boughs more silent than before: 

  I cannot say what loves have come and gone, 

  I only know that summer sang in me 

  A little while, that in me sings no more.",Sonnet
35,Elizabeth Barrett Browning,Sonnets From The Portuguese Iii,"GO from me. Yet I feel that I shall stand 
   Henceforward in thy shadow. Nevermore 
   Alone upon the threshold of my door 
Of individual life I shall command 
The uses of my soul, nor lift my hand 
   Serenely in the sunshine as before, 
   Without the sense of that which I forbore-- 
Thy touch upon the palm. The widest land 
Doom takes to part us, leaves thy heart in mine 
   With pulses that beat double. What I do 
And what I dream include thee, as the wine 
   Must taste of its own grapes. And when I sue 
God for myself, He hears that name of thine, 
   And sees within my eyes the tears of two.",Sonnet
36,Edna St. Vincent Millay,"Sonnets 03: Not With Libations, But With..","Not with libations, but with shouts and laughter
We drenched the altars of Love's sacred grove,
Shaking to earth green fruits, impatient after
The launching of the colored moths of Love.
Love's proper myrtle and his mother's zone
We bound about our irreligious brows,
And fettered him with garlands of our own,
And spread a banquet in his frugal house.
Not yet the god has spoken; but I fear
Though we should break our bodies in his flame,
And pour our blood upon his altar, here
Henceforward is a grove without a name,
A pasture to the shaggy goats of Pan,
Whence flee forever a woman and a man.",Sonnet
37,Edna St. Vincent Millay,"Sonnets 10: Oh, My Beloved, Have You Tho..","Oh, my beloved, have you thought of this:
How in the years to come unscrupulous Time,
More cruel than Death, will tear you from my kiss,
And make you old, and leave me in my prime?
How you and I, who scale together yet
A little while the sweet, immortal height
No pilgrim may remember or forget,
As sure as the world turns, some granite night
Shall lie awake and know the gracious flame
Gone out forever on the mutual stone;
And call to mind that on the day you came
I was a child, and you a hero grown?—
And the night pass, and the strange morning break
Upon our anguish for each other's sake!",Sonnet
38,Edna St. Vincent Millay,Sonnets 06: No Rose That In A Garden Eve..,"No rose that in a garden ever grew,
In Homer's or in Omar's or in mine,
Though buried under centuries of fine
Dead dust of roses, shut from sun and dew
Forever, and forever lost from view,
But must again in fragrance rich as wine
The grey aisles of the air incarnadine
When the old summers surge into a new.
Thus when I swear, ""I love with all my heart,""
'Tis with the heart of Lilith that I swear,
'Tis with the love of Lesbia and Lucrece;
And thus as well my love must lose some part
Of what it is, had Helen been less fair,
Or perished young, or stayed at home in Greece.",Sonnet
39,Edna St. Vincent Millay,Sonnets 02: Into The Golden Vessel Of Gr..,"Into the golden vessel of great song
Let us pour all our passion; breast to breast
Let other lovers lie, in love and rest;
Not we,—articulate, so, but with the tongue
Of all the world: the churning blood, the long
Shuddering quiet, the desperate hot palms pressed
Sharply together upon the escaping guest,
The common soul, unguarded, and grown strong.
Longing alone is singer to the lute;
Let still on nettles in the open sigh
The minstrel, that in slumber is as mute
As any man, and love be far and high,
That else forsakes the topmost branch, a fruit
Found on the ground by every passer-by.",Sonnet
40,Susan Williams,Penning Sonnets Or Pinning The Tails To ..,".
I respect those poets
who can pen sonnets 
and other rigidly ruled poems- 
They are extremely talented 
to be able to do this
and still enjoy the write! ! 
They have my utmost respect.
my admiration is unchecked.
Me? 
I am not at all respectable
I find it hard to be simultaneously
coherent, 
and poetic
and emotionally moving, 
when fitting syllables and rhymes into rigid formats! 
It's like trying to fit a hypo into a corset 
if you ask me.
.
~~~~~~~~ ©2018 Susan Williams",Sonnet
41,John Keats,Two Sonnets On Fame,"I.
Fame, like a wayward girl, will still be coy
To those who woo her with too slavish knees,
But makes surrender to some thoughtless boy,
And dotes the more upon a heart at ease;
She is a Gypsy,-will not speak to those
Who have not learnt to be content without her;
A Jilt, whose ear was never whisper'd close,
Who thinks they scandal her who talk about her;
A very Gypsy is she, Nilus-born,
Sister-in-law to jealous Potiphar;
Ye love-sick Bards! repay her scorn for scorn;
Ye Artists lovelorn! madmen that ye are!
Make your best bow to her and bid adieu,
Then, if she likes it, she will follow you.

II.
'You cannot eat your cake and have it too.'~Proverb.

How fever'd is the man, who cannot look
Upon his mortal days with temperate blood,
Who vexes all the leaves of his life's book,
And robs his fair name of its maidenhood;
It is as if the rose should pluck herself,
On the ripe plum finger its misty bloom,
As if a Naiad, like a meddling elf,
Should darken her pure grot with muddy gloom:
But the rose leaves herself upon the briar,
For winds to kiss and grateful bees to feed,
And the ripe plum still wears its dim attire,
The undisturbed lake has crystal space;
Why then should man, teasing the world for grace,
Spoil his salvation for a fierce miscreed?",Sonnet
42,William Shakespeare,Sonnets Cxvi: Let Me Not To The Marriage..,"Let me not to the marriage of true minds
    Admit impediments. Love is not love
    Which alters when it alteration finds,
    Or bends with the remover to remove.
    O no! it is an ever-fixed mark
    That looks on tempests and is never shaken;
    It is the star to every wand'ring bark,
    Whose worth's unknown, although his height be taken.
    Love's not Time's fool, though rosy lips and cheeks
  Within his bending sickle's compass come;
  Love alters not with his brief hours and weeks,
  But bears it out even to the edge of doom.
  If this be error and upon me prov'd,
  I never writ, nor no man ever lov'd.",Sonnet
43,Edna St. Vincent Millay,Sonnets 05: Once More Into My Arid Days ..,"Once more into my arid days like dew,
Like wind from an oasis, or the sound
Of cold sweet water bubbling underground,
A treacherous messenger, the thought of you
Comes to destroy me; once more I renew
Firm faith in your abundance, whom I found
Long since to be but just one other mound
Of sand, whereon no green thing ever grew.
And once again, and wiser in no wise,
I chase your colored phantom on the air,
And sob and curse and fall and weep and rise
And stumble pitifully on to where,
Miserable and lost, with stinging eyes,
Once more I clasp,—and there is nothing there.",Sonnet
44,Edna St. Vincent Millay,Two Sonnets In Memory,"(Nicola Sacco -- Bartolomeo Vanzetti)
Executed August 23, 1927
 
 
I

As men have loved their lovers in times past
And sung their wit, their virtue and their grace,
So have we loved sweet Justice to the last,
That now lies here in an unseemly place.
The child will quit the cradle and grow wise
And stare on beauty till his senses drown;
Yet shall be seen no more by mortal eyes
Such beauty as here walked and here went down.
Like birds that hear the winter crying plain
Her courtiers leave to seek the clement south;
Many have praised her, we alone remain
To break a fist against the lying mouth
Of any man who says this was not so:
Though she be dead now, as indeed we know.

II

Where can the heart be hidden in the ground
And be at peace, and be at peace forever,
Under the world, untroubled by the sound
Of mortal tears, that cease from pouring never?
Well for the heart, by stern compassion harried,
If death be deeper than the churchmen say, --
Gone from this world indeed what's graveward carried,
And laid to rest indeed what's laid away.
Anguish enough while yet the indignant breather
Have blood to spurt upon the oppressor's hand;
Who would eternal be, and hang in ether
A stuffless ghost above his struggling land,
Retching in vain to render up the groan
That is not there, being aching dust's alone?",Sonnet
45,William Shakespeare,Sonnets X,"THEN hate me when thou wilt; if ever, now; 
Now, while the world is bent my deeds to cross, 
Join with the spite of fortune, make me bow, 
And do not drop in for an after loss: 
Ah! do not, when my heart hath 'scaped this sorrow, 
Come in the rearward of a conquer'd woe; 
Give not a windy night a rainy morrow, 
To linger out a purposed overthrow. 
If thou wilt leave me, do not leave me last, 
When other petty griefs have done their spite, 
But in the onset come: so shall I taste 
At first the very worst of fortune's might; 
   And other strains of woe, which now seem woe, 
   Compared with loss of thee will not seem so!",Sonnet
46,Edna St. Vincent Millay,Sonnets 12: Cherish You Then The Hope I ..,"Cherish you then the hope I shall forget
At length, my lord, Pieria?—put away
For your so passing sake, this mouth of clay
These mortal bones against my body set,
For all the puny fever and frail sweat
Of human love,—renounce for these, I say,
The Singing Mountain's memory, and betray
The silent lyre that hangs upon me yet?
Ah, but indeed, some day shall you awake,
Rather, from dreams of me, that at your side
So many nights, a lover and a bride,
But stern in my soul's chastity, have lain,
To walk the world forever for my sake,
And in each chamber find me gone again!",Sonnet
47,Elizabeth Barrett Browning,Sonnets From The Portuguese V,"WHEN our two souls stand up erect and strong, 
   Face to face, silent, drawing nigh and nigher, 
   Until the lengthening wings break into fire 
At either curving point,--what bitter wrong 
Can the earth do us, that we should not long 
   Be here contented? Think! In mounting higher, 
   The angels would press on us, and aspire 
To drop some golden orb of perfect song 
Into our deep, dear silence. Let us stay 
   Rather on earth, Beloved--where the unfit 
Contrarious moods of men recoil away 
   And isolate pure spirits, and permit 
A place to stand and love in for a day, 
   With darkness and the death-hour rounding it.",Sonnet
