,Author,Title,Poem,Form
0,Helen Hunt Jackson,A Calendar Of Sonnets: January,"O Winter! frozen pulse and heart of fire, 
What loss is theirs who from thy kingdom turn 
Dismayed, and think thy snow a sculptured urn 
Of death! Far sooner in midsummer tire 
The streams than under ice. June could not hire 
Her roses to forego the strength they learn 
In sleeping on thy breast. No fires can burn 
The bridges thou dost lay where men desire 
In vain to build. 
O Heart, when Love's sun goes 
To northward, and the sounds of singing cease, 
Keep warm by inner fires, and rest in peace. 
Sleep on content, as sleeps the patient rose. 
Walk boldly on the white untrodden snows, 
The winter is the winter's own release.",Sonnet
1,Helen Hunt Jackson,A Calendar Of Sonnets: October,"The month of carnival of all the year, 
When Nature lets the wild earth go its way, 
And spend whole seasons on a single day. 
The spring-time holds her white and purple dear; 
October, lavish, flaunts them far and near; 
The summer charily her reds doth lay 
Like jewels on her costliest array; 
October, scornful, burns them on a bier. 
The winter hoards his pearls of frost in sign 
Of kingdom: whiter pearls than winter knew, 
Oar empress wore, in Egypt's ancient line, 
October, feasting 'neath her dome of blue, 
Drinks at a single draught, slow filtered through 
Sunshiny air, as in a tingling wine!",Sonnet
2,Edna St. Vincent Millay,[four Sonnets (1922)],"I1.
   Love, though for this you riddle me with darts, 
   And drag me at your chariot till I die, -- 
   Oh, heavy prince! Oh, panderer of hearts! -- 
   Yet hear me tell how in their throats they lie 
   Who shout you mighty: thick about my hair, 
   Day in, day out, your ominous arrows purr,  
   Who still am free, unto no querulous care 
   A fool, and in no temple worshiper! 
   I, that have bared me to your quiver's fire, 

  Lifted my face into its puny rain, 

  Do wreathe you Impotent to Evoke Desire 

  As you are Powerless to Elicit Pain! 

  (Now will the god, for blasphemy so brave, 

  Punish me, surely, with the shaft I crave!)  II2.
   I think I should have loved you presently, 
   And given in earnest words I flung in jest; 
   And lifted honest eyes for you to see, 
   And caught your hand against my cheek and breast; 
   And all my pretty follies flung aside 
   That won you to me, and beneath your gaze, 
   Naked of reticence and shorn of pride, 
   Spread like a chart my little wicked ways. 
   I, that had been to you, had you remained, 

  But one more waking from a recurrent dream, 

  Cherish no less the certain stakes I gained, 

  And walk your memory's halls, austere, supreme, 

  A ghost in marble of a girl you knew 

  Who would have loved you in a day or two. III3.
   Oh, think not I am faithful to a vow! 
   Faithless am I save to love's self alone. 
   Were you not lovely I would leave you now: 
   After the feet of beauty fly my own. 
   Were you not still my hunger's rarest food, 
   And water ever to my wildest thirst, 
   I would desert you -- think not but I would! -- 
   And seek another as I sought you first. 
   But you are mobile as the veering air, 

  And all your charms more changeful than the tide, 

  Wherefore to be inconstant is no care: 

  I have but to continue at your side. 

  So wanton, light and false, my love, are you, 

  I am most faithless when I most am true. IV4.
  I shall forget you presently, my dear, 
  So make the most of this, your little day, 
  Your little month, your little half a year, 
  Ere I forget, or die, or move away, 
  And we are done forever; by and by 
  I shall forget you, as I said, but now, 
  If you entreat me with your loveliest lie 
  I will protest you with my favorite vow. 
  I would indeed that love were longer-lived, 

  And vows were not so brittle as they are, 

  But so it is, and nature has contrived 

  To struggle on without a break thus far, -- 

  Whether or not we find what we are seeking 

  Is idle, biologically speaking.",Sonnet
3,Helen Hunt Jackson,A Calendar Of Sonnets: April,"No days such honored days as these! While yet 
Fair Aphrodite reigned, men seeking wide 
For some fair thing which should forever bide 
On earth, her beauteous memory to set 
In fitting frame that no age could forget, 
Her name in lovely April's name did hide, 
And leave it there, eternally allied 
To all the fairest flowers Spring did beget. 
And when fair Aphrodite passed from earth, 
Her shrines forgotten and her feasts of mirth, 
A holier symbol still in seal and sign, 
Sweet April took, of kingdom most divine, 
When Christ ascended, in the time of birth 
Of spring anemones, in Palestine.",Sonnet
4,Helen Hunt Jackson,A Calendar Of Sonnets: November,"This is the treacherous month when autumn days 
With summer's voice come bearing summer's gifts. 
Beguiled, the pale down-trodden aster lifts 
Her head and blooms again. The soft, warm haze 
Makes moist once more the sere and dusty ways, 
And, creeping through where dead leaves lie in drifts, 
The violet returns. Snow noiseless sifts 
Ere night, an icy shroud, which morning's rays 
Willidly shine upon and slowly melt, 
Too late to bid the violet live again. 
The treachery, at last, too late, is plain; 
Bare are the places where the sweet flowers dwelt. 
What joy sufficient hath November felt? 
What profit from the violet's day of pain?",Sonnet
5,Edna St. Vincent Millay,Sonnets 04: Only Until This Cigarette Is..,"Only until this cigarette is ended,
A little moment at the end of all,
While on the floor the quiet ashes fall,
And in the firelight to a lance extended,
Bizarrely with the jazzing music blended,
The broken shadow dances on the wall,
I will permit my memory to recall
The vision of you, by all my dreams attended.
And then adieu,—farewell!—the dream is done.
Yours is a face of which I can forget
The color and the features, every one,
The words not ever, and the smiles not yet;
But in your day this moment is the sun
Upon a hill, after the sun has set.",Sonnet
6,Helen Hunt Jackson,A Calendar Of Sonnets: September,"O golden month! How high thy gold is heaped! 
The yellow birch-leaves shine like bright coins strung 
On wands; the chestnut's yellow pennons tongue 
To every wind its harvest challenge. Steeped 
In yellow, still lie fields where wheat was reaped; 
And yellow still the corn sheaves, stacked among 
The yellow gourds, which from the earth have wrung 
Her utmost gold. To highest boughs have leaped 
The purple grape,--last thing to ripen, late 
By very reason of its precious cost. 
O Heart, remember, vintages are lost 
If grapes do not for freezing night-dews wait. 
Think, while thou sunnest thyself in Joy's estate, 
Mayhap thou canst not ripen without frost!",Sonnet
7,William Shakespeare,Sonnets Xviii: Shall I Compare Thee To A..,"Shall I compare thee to a summer's day?
    Thou art more lovely and more temperate.
    Rough winds do shake the darling buds of May,
    And summer's lease hath all too short a date.
    Sometime too hot the eye of heaven shines,
    And often is his gold complexion dimm'd;
    And every fair from fair sometime declines,
    By chance or nature's changing course untrimm'd;
    But thy eternal summer shall not fade
  Nor lose possession of that fair thou ow'st;
  Nor shall Death brag thou wander'st in his shade,
  When in eternal lines to time thou grow'st:
  So long as men can breathe or eyes can see,
  So long lives this, and this gives life to thee.",Sonnet
8,Christina Georgina Rossetti,Monna Innominata: A Sonnet Of Sonnets,"1

Lo dì che han detto a' dolci amici addio. - Dante
Amor, con quanto sforzo oggi mi vinci! - Petrarca

Come back to me, who wait and watch for you:--
Or come not yet, for it is over then,
And long it is before you come again,
So far between my pleasures are and few.
While, when you come not, what I do I do
Thinking ""Now when he comes,"" my sweetest when:""
For one man is my world of all the men
This wide world holds; O love, my world is you.
Howbeit, to meet you grows almost a pang
Because the pang of parting comes so soon;
My hope hangs waning, waxing, like a moon
Between the heavenly days on which we meet:
Ah me, but where are now the songs I sang
When life was sweet because you call'd them sweet? 

2 

Era già 1'ora che volge il desio. - Dante
Ricorro al tempo ch' io vi vidi prima. - Petrarca

I wish I could remember that first day,
First hour, first moment of your meeting me,
If bright or dim the season, it might be
Summer or winter for aught I can say;
So unrecorded did it slip away,
So blind was I to see and to foresee,
So dull to mark the budding of my tree
That would not blossom yet for many a May.
If only I could recollect it, such
A day of days! I let it come and go
As traceless as a thaw of bygone snow;
It seem'd to mean so little, meant so much;
If only now I could recall that touch,
First touch of hand in hand--Did one but know! 


3 

O ombre vane, fuor che ne l'aspetto!  - Dante
Immaginata guida la conduce. - Petrarca

I dream of you to wake: would that I might
Dream of you and not wake but slumber on;
Nor find with dreams the dear companion gone,
As summer ended summer birds take flight.
In happy dreams I hold you full in sight,
I blush again who waking look so wan;
Brighter than sunniest day that ever shone,
In happy dreams your smile makes day of night.
Thus only in a dream we are at one,
Thus only in a dream we give and take
The faith that maketh rich who take or give;
If thus to sleep is sweeter than to wake,
To die were surely sweeter than to live,
Though there be nothing new beneath the sun. 


4 

Poca favilla gran fliamma seconda. - Dante
Ogni altra cosa, ogni pensier va fore,
E sol ivi con voi rimansi amore.  - Petrarca

I lov'd you first: but afterwards your love
Outsoaring mine, sang such a loftier song
As drown'd the friendly cooings of my dove.
Which owes the other most? my love was long,
And yours one moment seem'd to wax more strong;
I lov'd and guess'd at you, you construed me--
And lov'd me for what might or might not be
Nay, weights and measures do us both a wrong.
For verily love knows not ""mine"" or ""thine;""
With separate ""I"" and ""thou"" free love has done,
For one is both and both are one in love:
Rich love knows nought of ""thine that is not mine;""
Both have the strength and both the length thereof,
Both of us, of the love which makes us one. 


5 

Amor che a nullo amato amar perdona. - Dante
Amor m'addusse in sì gioiosa spene. - Petrarca

O my heart's heart, and you who are to me
More than myself myself, God be with you,
Keep you in strong obedience leal and true
To Him whose noble service setteth free,
Give you all good we see or can foresee,
Make your joys many and your sorrows few,
Bless you in what you bear and what you do,
Yea, perfect you as He would have you be.
So much for you; but what for me, dear friend?
To love you without stint and all I can
Today, tomorrow, world without an end;
To love you much and yet to love you more,
As Jordan at his flood sweeps either shore;
Since woman is the helpmeet made for man. 


6 

Or puoi la quantitate
Comprender de l'amor che a te mi scalda. - Dante
Non vo' che da tal nodo mi scioglia.  - Petrarca

Trust me, I have not earn'd your dear rebuke,
I love, as you would have me, God the most;
Would lose not Him, but you, must one be lost,
Nor with Lot's wife cast back a faithless look
Unready to forego what I forsook;
This say I, having counted up the cost,
This, though I be the feeblest of God's host,
The sorriest sheep Christ shepherds with His crook.
Yet while I love my God the most, I deem
That I can never love you overmuch;
I love Him more, so let me love you too;
Yea, as I apprehend it, love is such
I cannot love you if I love not Him,
I cannot love Him if I love not you. 


7 

Qui primavera sempre ed ogni frutto. - Dante
Ragionando con meco ed io con lui.  - Petrarca

""Love me, for I love you""--and answer me,
""Love me, for I love you""--so shall we stand
As happy equals in the flowering land
Of love, that knows not a dividing sea.
Love builds the house on rock and not on sand,
Love laughs what while the winds rave desperately;
And who hath found love's citadel unmann'd?
And who hath held in bonds love's liberty?
My heart's a coward though my words are brave
We meet so seldom, yet we surely part
So often; there's a problem for your art!
Still I find comfort in his Book, who saith,
Though jealousy be cruel as the grave,
And death be strong, yet love is strong as death. 


8 

Come dicesse a Dio: D'altro non calme.  - Dante
Spero trovar pietà non che perdono.  - Petrarca

""I, if I perish, perish""--Esther spake:
And bride of life or death she made her fair
In all the lustre of her perfum'd hair
And smiles that kindle longing but to slake.
She put on pomp of loveliness, to take
Her husband through his eyes at unaware;
She spread abroad her beauty for a snare,
Harmless as doves and subtle as a snake.
She trapp'd him with one mesh of silken hair,
She vanquish'd him by wisdom of her wit,
And built her people's house that it should stand:--
If I might take my life so in my hand,
And for my love to Love put up my prayer,
And for love's sake by Love be granted it! 


9 

O dignitosa coscienza e netta! - Dante
Spirto più acceso di virtuti ardenti. - Petrarca

Thinking of you, and all that was, and all
That might have been and now can never be,
I feel your honour'd excellence, and see
Myself unworthy of the happier call:
For woe is me who walk so apt to fall,
So apt to shrink afraid, so apt to flee,
Apt to lie down and die (ah, woe is me!)
Faithless and hopeless turning to the wall.
And yet not hopeless quite nor faithless quite,
Because not loveless; love may toil all night,
But take at morning; wrestle till the break
Of day, but then wield power with God and man:--
So take I heart of grace as best I can,
Ready to spend and be spent for your sake. 


10 

Con miglior corso e con migliore stella.  - Dante
La vita fugge e non s'arresta un' ora.  - Petrarca

Time flies, hope flags, life plies a wearied wing;
Death following hard on life gains ground apace;
Faith runs with each and rears an eager face,
Outruns the rest, makes light of everything,
Spurns earth, and still finds breath to pray and sing;
While love ahead of all uplifts his praise,
Still asks for grace and still gives thanks for grace,
Content with all day brings and night will bring.
Life wanes; and when love folds his wings above
Tired hope, and less we feel his conscious pulse,
Let us go fall asleep, dear friend, in peace:
A little while, and age and sorrow cease;
A little while, and life reborn annuls
Loss and decay and death, and all is love. 


11 

Vien dietro a me e lascia dir le genti. - Dante
Contando i casi della vita nostra.  - Petrarca

Many in aftertimes will say of you
""He lov'd her""--while of me what will they say?
Not that I lov'd you more than just in play,
For fashion's sake as idle women do.
Even let them prate; who know not what we knew
Of love and parting in exceeding pain,
Of parting hopeless here to meet again,
Hopeless on earth, and heaven is out of view.
But by my heart of love laid bare to you,
My love that you can make not void nor vain,
Love that foregoes you but to claim anew
Beyond this passage of the gate of death,
I charge you at the Judgment make it plain
My love of you was life and not a breath. 


12 

Amor, che ne la mente mi ragiona. - Dante
Amor vien nel bel viso di costei.  - Petrarca

If there be any one can take my place
And make you happy whom I grieve to grieve,
Think not that I can grudge it, but believe
I do commend you to that nobler grace,
That readier wit than mine, that sweeter face;
Yea, since your riches make me rich, conceive
I too am crown'd, while bridal crowns I weave,
And thread the bridal dance with jocund pace.
For if I did not love you, it might be
That I should grudge you some one dear delight;
But since the heart is yours that was mine own,
Your pleasure is my pleasure, right my right,
Your honourable freedom makes me free,
And you companion'd I am not alone. 


13 

E drizzeremo gli occhi al Primo Amore. - Dante
Ma trovo peso non da le mie braccia.  - Petrarca

If I could trust mine own self with your fate,
Shall I not rather trust it in God's hand?
Without Whose Will one lily doth not stand,
Nor sparrow fall at his appointed date;
Who numbereth the innumerable sand,
Who weighs the wind and water with a weight,
To Whom the world is neither small nor great,
Whose knowledge foreknew every plan we plann'd.
Searching my heart for all that touches you,
I find there only love and love's goodwill
Helpless to help and impotent to do,
Of understanding dull, of sight most dim;
And therefore I commend you back to Him
Whose love your love's capacity can fill. 


14 

E la Sua Volontade è nostra pace. - Dante
Sol con questi pensier, con altre chiome.  - Petrarca

Youth gone, and beauty gone if ever there
Dwelt beauty in so poor a face as this;
Youth gone and beauty, what remains of bliss?
I will not bind fresh roses in my hair,
To shame a cheek at best but little fair,--
Leave youth his roses, who can bear a thorn,--
I will not seek for blossoms anywhere,
Except such common flowers as blow with corn.
Youth gone and beauty gone, what doth remain?
The longing of a heart pent up forlorn,
A silent heart whose silence loves and longs;
The silence of a heart which sang its songs
While youth and beauty made a summer morn,
Silence of love that cannot sing again.",Sonnet
9,Rainer Maria Rilke,The Sonnets To Orpheus: Book 2: Xiii,"Be ahead of all parting, as though it already were
behind you, like the winter that has just gone by.
For among these winters there is one so endlessly winter
that only by wintering through it all will your heart survive.

Be forever dead in Eurydice-more gladly arise
into the seamless life proclaimed in your song.
Here, in the realm of decline, among momentary days,
be the crystal cup that shattered even as it rang.

Be-and yet know the great void where all things begin,
the infinite source of your own most intense vibration,
so that, this once, you may give it your perfect assent.

To all that is used-up, and to all the muffled and dumb
creatures in the world's full reserve, the unsayable sums,
joyfully add yourself, and cancel the count.


Translated by Stephen Mitchell",Sonnet
10,Helen Hunt Jackson,A Calendar Of Sonnets: December,"The lakes of ice gleam bluer than the lakes 
Of water 'neath the summer sunshine gleamed: 
Far fairer than when placidly it streamed, 
The brook its frozen architecture makes, 
And under bridges white its swift way takes. 
Snow comes and goes as messenger who dreamed 
Might linger on the road; or one who deemed 
His message hostile gently for their sakes 
Who listened might reveal it by degrees. 
We gird against the cold of winter wind 
Our loins now with mighty bands of sleep, 
In longest, darkest nights take rest and ease, 
And every shortening day, as shadows creep 
O'er the brief noontide, fresh surprises find.",Sonnet
11,Helen Hunt Jackson,A Calendar Of Sonnets: July,"Some flowers are withered and some joys have died; 
The garden reeks with an East Indian scent 
From beds where gillyflowers stand weak and spent; 
The white heat pales the skies from side to side; 
But in still lakes and rivers, cool, content, 
Like starry blooms on a new firmament, 
White lilies float and regally abide. 
In vain the cruel skies their hot rays shed; 
The lily does not feel their brazen glare. 
In vain the pallid clouds refuse to share 
Their dews, the lily feels no thirst, no dread. 
Unharmed she lifts her queenly face and head; 
She drinks of living waters and keeps fair.",Sonnet
12,Rainer Maria Rilke,The Sonnets To Orpheus: I,"A tree ascended there. Oh pure transendence!
Oh Orpheus sings! Oh tall tree in the ear!
And all things hushed. Yet even in that silence
a new beginning, beckoning, change appeared.

Creatures of stillness crowded from the bright
unbound forest, out of their lairs and nests;
and it was not from any dullness, not
from fear, that they were so quiet in themselves,

but from just listening. Bellow, roar, shriek
seemed small inside their hearts. And where there had been
at most a makeshift hut to receive the music,

a shelter nailed up out of their darkest longing,
with an entryway that shuddered in the wind-
you built a temple deep inside their hearing.


Translated by Stephen Mitchell",Sonnet
13,Rainer Maria Rilke,The Sonnets To Orpheus: Book 2: I,"Breathing: you invisible poem! Complete
interchange of our own
essence with world-space. You counterweight
in which I rythmically happen.

Single wave-motion whose
gradual sea I am:
you, most inclusive of all our possible seas-
space has grown warm.

How many regions in space have already been
inside me. There are winds that seem like
my wandering son.

Do you recognize me, air, full of places I once absorbed?
You who were the smooth bark,
roundness, and leaf of my words. 


Translated by Stephen Mitchell",Sonnet
14,Elizabeth Barrett Browning,Sonnets From The Portuguese Iv,"IF thou must love me, let it be for naught 
   Except for love's sake only. Do not say, 
   'I love her for her smile--her look--her way 
Of speaking gently,--for a trick of thought 
That falls in well with mine, and certes brought 
   A sense of pleasant ease on such a day'-- 
   For these things in themselves, Beloved, may 
Be changed, or change for thee--and love, so wrought, 
May be unwrought so. Neither love me for 
   Thine own dear pity's wiping my cheeks dry: 
A creature might forget to weep, who bore 
   Thy comfort long, and lose thy love thereby! 
But love me for love's sake, that evermore 
   Thou mayst love on, through love's eternity.",Sonnet
15,Edna St. Vincent Millay,Sonnets 07: When I Too Long Have Looked ..,"When I too long have looked upon your face,
Wherein for me a brightness unobscured
Save by the mists of brightness has its place,
And terrible beauty not to be endured,
I turn away reluctant from your light,
And stand irresolute, a mind undone,
A silly, dazzled thing deprived of sight
From having looked too long upon the sun.
Then is my daily life a narrow room
In which a little while, uncertainly,
Surrounded by impenetrable gloom,
Among familiar things grown strange to me
Making my way, I pause, and feel, and hark,
Till I become accustomed to the dark.",Sonnet
16,Rainer Maria Rilke,The Sonnets To Orpheus: Xix,"Though the world keeps changing its form
as fast as a cloud, still
what is accomplished falls home
to the Primeval.

Over the change and the passing,
larger and freer,
soars your eternal song,
god with the lyre.

Never has grief been possesed,
never has love been learned,
and what removes us in death

is not revealed.
Only the song through the land
hallows and heals.


Translated by Stephen Mitchell",Sonnet
17,Helen Hunt Jackson,A Calendar Of Sonnets: August,"Silence again. The glorious symphony 
Hath need of pause and interval of peace. 
Some subtle signal bids all sweet sounds cease, 
Save hum of insects' aimless industry. 
Pathetic summer seeks by blazonry 
Of color to conceal her swift decrease. 
Weak subterfuge! Each mocking day doth fleece 
A blossom, and lay bare her poverty. 
Poor middle-aged summer! Vain this show! 
Whole fields of Golden-Rod cannot offset 
One meadow with a single violet; 
And well the singing thrush and lily know, 
Spite of all artifice which her regret 
Can deck in splendid guise, their time to go!",Sonnet
18,Christina Georgina Rossetti,Sonnets Are Full Of Love,"Sonnets are full of love, and this my tome 
Has many sonnets: so here now shall be 
One sonnet more, a love sonnet, from me 
To her whose heart is my heart's quiet home, 
To my first Love, my Mother, on whose knee 
I learnt love-lore that is not troublesome; 
Whose service is my special dignity, 
And she my loadstare while I go and come 
And so because you love me, and because 
I love you, Mother, I have woven a wreath 
Of rhymes wherewith to crown your honoured name: 
In you not fourscore years can dim the flame 
Of love, whose blessed glow transcends the laws 
Of time and change and mortal life and death.",Sonnet
19,Edna St. Vincent Millay,"Sonnets 01: We Talk Of Taxes, And I Call..","We talk of taxes, and I call you friend;
Well, such you are,—but well enough we know
How thick about us root, how rankly grow
Those subtle weeds no man has need to tend,
That flourish through neglect, and soon must send
Perfume too sweet upon us and overthrow
Our steady senses; how such matters go
We are aware, and how such matters end.
Yet shall be told no meagre passion here;
With lovers such as we forevermore
Isolde drinks the draught, and Guinevere
Receives the Table's ruin through her door,
Francesca, with the loud surf at her ear,
Lets fall the colored book upon the floor.",Sonnet
20,Helen Hunt Jackson,A Calendar Of Sonnets: March,"Month which the warring ancients strangely styled 
The month of war,--as if in their fierce ways 
Were any month of peace!--in thy rough days 
I find no war in Nature, though the wild 
Winds clash and clang, and broken boughs are piled 
As feet of writhing trees. The violets raise 
Their heads without affright, without amaze, 
And sleep through all the din, as sleeps a child. 
And he who watches well may well discern 
Sweet expectation in each living thing. 
Like pregnant mother the sweet earth doth yearn; 
In secret joy makes ready for the spring; 
And hidden, sacred, in her breast doth bear 
Annunciation lilies for the year.",Sonnet
